TwitchCategoryId,Language,Name,Synopsis,Summary,Source,IGDBId,SteamId
21101,,Batman: Arkham Asylum,,"Using a great variety of gadgets you must make your way around the island, and the asylums halls to find and stop the joker. The game uses a 3-button combat system, but with a great number of gadget abilites which Batman can unlock. This makes for a very cinematic combat experience when fighting the Joker's goons.",,500,35010
21101,ru,Batman: Arkham Asylum,,Почувствуйте каково быть Бэтменом и сражаться с самыми опасными злодеями в городе Готаме. Исследуйте каждый дюйм психбольницы Аркхем и свободно перемещайтесь по знаменитому острову.,steam,500,35140
491437,ru,Call of Duty: Infinite Warfare,,"Infinite Warfare включает в себя три уникальных режима игры: кампанию, cетевую игру и режим &quot;Зомби&quot;.",steam,18968,292730
7240,,Mega Man Legends,,"THE BLUE BOMBER BLASTS INTO A WHOLE NEW DIMENSION 
 
Mega Man blasts his way into the third dimension in an amazing new adventure. Mega Man Legends combines the best of classic Mega Man action with enormous bosses, a riveting storyline and all the depth of the hottest RPG. 
 
Explore vast 3-D worlds in your quest to find the treasure of all treasures, the Mother Lode. You'll love the new 3-D graphics, deadly weapons and non-stop action... unless of course, you're a boss. 
 
* Awesome Weapons! 
* Diabolical Bosses! 
* Legendary Gameplay! 
* Non-Stop 3-D Action!",,1752,
492487,ru,Furi,,"Тюремщик — путь на волю. Убей его, и ты свободен.",steam,17026,423230
499751,ru,It's Quiz Time,,"Сразитесь с друзьями в новой огромной викторине на приставке! Наша хитрая ведущая-ИИ Салли и каталог It’s Quiz Time из более чем 25 000 вопросов — залог отличной игры. Сыграйте с друзьями на смартфоне (до 8 соперников), играйте в одиночку или ведите трансляции и играйте со зрителями в режиме «Прямой эфир»!",steam,75227,648780
512058,ru,Unrailed!,,"Unrailed! — многопользовательская игра, в которой вам предстоит построить железную дорогу в бесконечном процедурно генерируемом мире. Вам придется работать сообща, улучшать вагоны, следить, чтобы поезд не сошел с рельсов, и быть готовыми ко всему!",steam,115201,1016920
15866,ru,BioShock,,"BioShock - шутер, не похожий ни на один из тех, в которые вы играли, полный невообразимых видов оружия и тактик. В вашем распоряжении будет весь арсенал от обычных револьверов до гранатометов и распылителей химического оружия, а вдобавок вы сможете модифицировать свой ДНК чтобы создать еще более смертельное оружие: вас.",steam,20,7670
15825,ru,Worms Armageddon,,Those intrepid invertebrates return with a vengeance in the much-loved Worms™ Armageddon. It’s a whole new can of worms! It’s hilarious fun that you can enjoy on your own or with all your friends.,steam,948,217200
459839,ru,Assassin's Creed: Unity,,"Assassin’s Creed® Единство – это история Арно, юноши, оказавшегося в центре Великой французской революции. В одиночной или совместной игре добейтесь поставленных целей – станьте мастером-ассасином.",steam,5606,289650
491181,ru,Oxenfree,,"Oxenfree — это мистический триллер о группе друзей, которые случайно открывают разлом в призрачный мир. Вам предстоит примерить на себя роль Алекс, девушки, которая только что привезла своего новоиспеченного сводного брата на вечеринку на острове, где всё пошло не так.",steam,14587,388880
7839,ru,Tomb Raider: Legend,,"Follow Lara Croft down a path of discovery as she travels the globe to remote, exotic locales in search of one of history's greatest artifacts, that unleashes unwelcome figures from Lara's mysterious past.",steam,1161,7000
65718,ru,LEGO The Lord of the Rings,,"Based on The Lord of the Rings motion picture trilogy, LEGO® The Lord of the Rings follows the original story-lines of The Lord of the Rings: The Fellowship of the Ring, The Lord of the Rings: The Two Towers, and The Lord of the Rings: The Return of the King, taking players through the epic story events re-imagined with the humor and endl",steam,4969,214510
499379,ru,Stick Fight: The Game,,Stick Fight is a physics-based couch/online fighting game where you battle it out as the iconic stick figures from the golden age of the internet.,steam,65832,674940
490348,ru,Dishonored 2,,"В игре Dishonored 2, вы снова окажетесь в роли ассасина со сверхъестественными способностями. Сайт IGN назвал эту игру «удивительной» и «идеальным продолжением», Eurogamer признал ее «шедевром», а Game Informer считает, что «эта история о мести – одна из лучших в своем жанре и проходить мимо нее ни в коем случае нельзя»; Dishonored 2 –...",steam,11118,403640
1949521322,ru,From Darkness,,"From the darkness of the forest, bandits and looters will aim to destroy your way of life and demolish your livelihood. With the help of vagabonds and villagers, build a thriving town, raise an army and defend your home. Each night brings with it more enemies, so be sure to keep up.",steam,113319,918550
417694,ru,Town of Salem,,"Inspired by the party games Werewolf and Mafia, Town of Salem is a game of murder, mystery and deception.",steam,9658,334230
508865,ru,Synth Riders,,Зацените грув в Synth Riders! В этой киберпанковой VR-ритм-игре летают ноты и пульсирует ритм. Синтвейв-музыка захватила мир - самое время погрузиться в нее целиком.,steam,105333,885000
504610,ru,AMID EVIL,,A retro FPS for the ages! Once branded a HERETIC. Now YOU have been chosen as our champion! Reclaim our sacred weapons. Take back our ancient lands. If you can stand... AMID EVIL.,steam,74904,673130
418020,,The Sandbox,,"The Sandbox is a unique world building & crafting game featuring over 200+ physics elements presented in 2D pixel blocks that can interact with each others. Players can craft amazing worlds, create pixel art, chain reactions, chiptune music, advanced contraptions, electric circuits or just play with physics. 
 
Play with basic elements ranging from simple water, stone, sand, wood, glass, lava, fire, to more complex: electricity, metal, virus, antivirus,heater, cooler, lasers, pipes, gems, sensors, leds TNT, C4, crosswire, conveyor belt, music instruments etc.",,16872,265810
418020,ru,The Sandbox,,"READY FOR CRAFTING VIRTUAL WORLDS ON YOUR PC?The acclaimed world-building game featuring a unique mission-based approach is coming onto PC via Steam Early Access. With over 16 million players on mobile &amp; tablets versions and 1,500,000 pixel blocks creations shared in the Online Gallery to date, this PC version is taking world...",steam,16872,265810
1090408381,ru,State of Decay 2: Juggernaut Edition,,"Мертвые ожили, а цивилизация пала. В этой игре, сочетающей в себе элементы боевика, стратегии и симулятора, вашей небольшой группе выживших необходимо собирать ресурсы для постройки такой базы, которая устоит перед полчищами ходячих мертвецов.",steam,19541,495420
1809899630,ru,The Darkside Detective: A Fumble in the Dark,,"Рассыпьте по дому шалфей и приготовьте походную доску для спиритизма — пора вернуться в Твин Лейкс, город, который по населению духов занимает в Америке 34-е место. Присоединяйтесь к детективу Мак-Квину, который не жалея пиксельного живота расследует шесть зловещих тайн этого несчастного города.",steam,109650,795420
490496,,Lara Croft GO,,"Lara Croft GO expands the turn-based puzzle gameplay and takes you on an adventure set in a long-forgotten world. Explore the ruins of an ancient civilization, discover hidden secrets and face deadly challenges as you uncover the myth of the Queen of Venom. 
 
A never-before-seen take on the iconic franchise featuring challenging gameplay, gorgeous visuals and a mesmerizing soundtrack, all at your fingertips.",,11592,540840
490496,ru,Lara Croft GO,,"Lara Croft GO is a turn based puzzle-adventure set in a long-forgotten world. Explore the ruins of an ancient civilization, discover well-kept secrets and face deadly challenges as you uncover the myth of the Queen of Venom.",steam,11592,540840
506272,ru,The Blackout Club,,"The Blackout Club - это кооперативная хоррор-игра от первого лица, в центре которой группа друзей-подростков, расследующие чудовищную тайну, что таится прямо под их маленьким городом. 1-4 игрока исследуют процедурно-сгенерированные задания против грозного врага, которого вы можете увидеть только с закрытыми глазами.",steam,89562,599080
65867,ru,Divinity: Original Sin,,Divinity: Original Sin – это новая RPG в духе старой школы. Здесь можно обсуждать свои решения с напарниками; сражаться в тактических пошаговых боях; исследовать огромный открытый мир и взаимодействовать с любыми предметами и персонажами.,steam,5082,230230
493835,,Sally Face,,"In this story-driven adventure game, players will interact with Sal's world and his nightmares. The main path typically requires casual effort. However, there are hidden surprises to be found and bonus mysteries that may invoke a bit of head-scratching for those players up to the challenge.",,26580,541570
493835,ru,Sally Face,,"Погрузитесь в мрачное приключение мальчика с протезом на лице и тяжелым прошлым. Распутайте зловещую тайну истории Салли, чтобы отыскать правду, скрытую завесой тьмы.",steam,26580,541570
489738,ru,60 Seconds!,,"60 Seconds! - это чёрная комедия о выживании и приключениях в условиях ядерного взрыва. Собери запасы и спаси свою семью до того, как взорвётся бомба. Выживи в своём противоатомном убежище. Принимай трудные решения, разделяй запасы и воюй с тараканами. И может, тебе удастся выжить. Или нет.",steam,11709,368360
30608,,TOCA Race Driver,,"TOCA Race Driver (Pro Race Driver in North America and V8 Supercar: Race Driver in Australia) is a racing video game developed and published by Codemasters, being part of the TOCA Touring Car series. 
 
The game took a new direction, since the main game mode featured a plot (leading to the game being labelled as a ""Car-PG"") where the user took on the role of a fictional race driver called Ryan McKane, trying to make a name for himself in a multitude of car championships, all the while under the shadow of his more successful older brother and haunted by the death of his father on the racetrack (as witnessed by Ryan as a child). 
 
Despite this slightly clichéd script, the racing elements of the game continued to receive positive reviews and the game went straight to number one in the UK game charts. Xbox and PC conversions followed in March 2003, with a further Xbox version released several months later at budget price adding Xbox Live support. 
 
The British Touring Car Championship (TOCA) which gives the game series its name, returned for this game. The real-life championship had undergone a transformation after most of the manufacturers had pulled out, and crowd numbers dropped, so TOCA asked Codemasters to include the series to boost the audience interest. However, the return was short-lived. 
 
Many tracks were added, and some of the ""World"" tracks were not continued from TOCA 3, despite their popularity, such as Watkins Glen and Surfers Paradise. The game continued with random grid positions and no penalties for bad driving.",,2483,
497972,ru,The Letter,,"When seven people fall prey to a vicious curse, they will discover that horror rests not from the shadows lurking about, but within themselves. To what ends will one go in order to survive?",steam,33062,460430
31836,ru,Metro: Last Light,,"It is the year 2034. Beneath the ruins of post-apocalyptic Moscow, in the tunnels of the Metro, the remnants of mankind are besieged by deadly threats from outside – and within. Mutants stalk the catacombs beneath the desolate surface, and hunt amidst the poisoned skies above.",steam,539,287390
514322,,Remothered: Broken Porcelain,,"Broken Porcelain brings an abundance of welcome changes to the series, introducing new gameplay and storytelling elements that breathe new life into the characters and an unprecedented level of immersion in this haunting adventure – perfect for both new and returning fans to the series.",,117309,1142390
514322,ru,Remothered: Broken Porcelain,,"Дополнение Broken Porcelain внесёт в серию много долгожданных изменений, добавит новую механику игры и сюжетные элементы, которые вдохнут новую жизнь в персонажей и позволят ещё глубже погрузиться в жуткое приключение. Дополнение понравится как новым игрокам, так и давним любителям серии.",steam,117309,1142390
497852,ru,Business Tour,,"&quot;Бизнес Тур&quot; - бесплатная настольная онлайн игра. Собирай монополию. Выполняй ежедневные задания, участвуй в соревнованиях среди других игроков, а после выгодно обменивай полученные награды. Покупайте участки и собирайте с них ренту, приведите своих конкурентов к банкротству!",steam,34549,397900
498423,ru,Iron Harvest,,"Классическая стратегия в реальном времени с потрясающей одиночной кампанией, многопользовательским режимом и возможностью совместной игры, действие которой происходит в альтернативной реальности 1920+",steam,25581,826630
14263,,Kirby Air Ride,,"Kirby Air Ride is a 2003 racing game video game developed by HAL Laboratory and published by Nintendo for the Nintendo GameCube video game console. The game has the players and computer-controlled racers ride on Air Ride Machines. The game supports up to four players, and was the first GameCube title to support LAN play using broadband adapters and up to four GameCube systems. Players take control of Kirby or any of his multicolored counterparts to compete in races or other minigames. The game consists of three different game modes: Air Ride, Top Ride, and City Trial.",,2777,
498421,ru,Ken Follett's: The Pillars of the Earth,,"Англия, XII век. В маленьком городке начинается строительство собора с целью дать людям безопасность и средства к существованию. В борьбе и невзгодах переплетаются жизни и судьбы. основанная на бестселлере Кена Фоллетта &quot;Столпы Земли&quot;.",steam,19297,234270
16951,ru,Killer Instinct,,"Легендарная серия файтинг-игр возвращается, неся с собой обновленные визуальные эффекты, зашкаливающую динамику, потрясающий выбор бойцов, заводную музыку и ПР-Р-Р-РЕРЫВАТЕЛИ КОМБО!!! Выберите себе бойца по вкусу, ведь каждый из них — это классная анимация, уникальная тактика боя и захватывающие спецприемы.",steam,10354,577940
507909,,Darts Match,,A darts game from MotionLab.,,58143,
496236,ru,Sonic Forces,,"Судьба мира, в котором живет Соник, теперь в ваших руках. Присоединяйтесь к сопротивлению!",steam,21063,637100
515195,ru,Half-Life: Alyx,,"﻿Half-Life: Alyx — это возвращение Valve во вселенную Half-Life в виртуальной реальности. Это история невозможной борьбы с жестокой расой пришельцев, известной как Альянс. События происходят между Half-Life и Half-Life 2. Вы играете за Аликс Вэнс, и вы — единственный шанс человечества на спасение.",steam,126098,546560
18814,ru,The Sims 3,,Новый контент для The Sims 3 уже доступен!,steam,260,47890
492963,,Vampire: The Masquerade,,,,,
498458,ru,Attack on Titan 2,,"Отриньте все страхи. A.O.T. 2 — это продолжение игры, основанной на популярном во всем мире аниме «Attack on Titan».",steam,55028,601050
491471,,HITMAN,,"Become the Master Assassin in an intense spy-thriller story. As Agent 47, you perform contract hits on powerful, high-profile targets in exotic locations around the world. Gameplay focuses on taking out targets in huge and intricate sandbox levels with complete freedom of approach. Where to go, when to strike and who to kill – it is all up to you. 
 
HITMAN is an expanding and evolving world of assassination. The experience began with a Prologue and Paris location in March, continued with Episode 2: Sapienza in April, Episode 3: Marrakesh in May, the Summer Bonus Episode in July, Episode 4: Bangkok in August and Episode 5: Colorado in September. The season finale in Hokkaido, Japan arrived on October 31st. 
 
HITMAN also features a major live component, which is made up of Elusive Targets, Escalation Contracts, Community-inspired Challenge Packs and Contracts Mode. 
 
An Elusive Target is the closest thing to the Hitman fantasy that we’ve ever created. These targets will be custom-created characters that are added to existing locations and are only there for a limited time in real-time. You’ll only have one chance to take them down. If they escape, they are gone for good. If you kill them, that’s the way that you killed them. There are no do-overs and no second chances. When an Elusive Target leaves the game world (one way or another) they never return. 
 
Escalation Mode is something else completely new for HITMAN and was created as a way to regularly provide a fresh challenge to players. You’ll need to master the location as well as the gameplay mechanics to complete a hit that will escalate in difficulty by adding new elements. This mode has a strong focus on having fun with the game mechanics and mixing them up. It’s more about being playful than realistic. 
 
Contracts Mode returns from Hitman Absolution; Play-to-create, mark your own targets, choose how to kill them and compete against your friends. We will also pick the best of the bunch and put them in the Featured Contracts list so you’ve got something fresh to play whenever you load up the game.",,11157,236870
491471,ru,HITMAN,,"Рядом с нашим миром есть другой. В нем нет наций, правосудия, этики. Он никогда не спит. Существует повсюду. И попав в него... назад уже не вернуться. Добро пожаловать в мир заказных убийств. Вы — Агент 47, лучший наемный убийца в мире.",steam,11157,236870
32178,fr,Octodad: Dadliest Catch,,"Octodad: Dadliest Catch est un jeu sur la destruction, l'illusion et la paternité. Le joueur incarne Octodad, un sympathique poulpe qui tente de mener une vie ordinaire en se faisant passer pour un humain.",steam,4788,224480
67562,fr,Freedom Planet,,Freedom Planet est un jeu de plate-forme de combat inspiré de dessins animés où une dragonoïde téméraire et ses amies affrontent une attaque d'aliens.,steam,7116,248310
514425,fr,Later Alligator,,"Pat the alligator, a (mostly) harmless and (probably) innocent reptile is at the center of a conspiracy that could bring down the biggest, scariest family in Alligator New York City: his own! Explore the city, meet the Family, and try to save Pat before the clock runs out.",steam,112939,966320
513914,fr,Chicken Police,,"Une folle histoire d'amour, de mort, de poulets et de rédemption ! Chicken Police est un jeu policier d'aventure qui se déroule dans un monde soigneusement élaboré. L'histoire est crue, mais ne manque pas d'une bonne dose d'humour absurde.",steam,119323,1084640
510598,fr,Maiden & Spell,,"Maiden &amp; Spell is a magical girl battle game, set in a cutesy fantasy world. Select from one of eight young ladies to battle 1 on 1 with a friend, or fight your way through a series of bosses and learn the secrets of The Kingdom of Stars.",steam,104679,1004770
418020,fr,The Sandbox,,"READY FOR CRAFTING VIRTUAL WORLDS ON YOUR PC?The acclaimed world-building game featuring a unique mission-based approach is coming onto PC via Steam Early Access. With over 16 million players on mobile &amp; tablets versions and 1,500,000 pixel blocks creations shared in the Online Gallery to date, this PC version is taking world...",steam,16872,265810
490496,fr,Lara Croft GO,,"Lara Croft GO est un jeu de réflexion au tour par tour qui se déroule dans un monde oublié depuis longtemps. Explorez les ruines d'une ancienne civilisation, découvrez des secrets bien gardés et faites face à des défis mortels tandis que vous dévoilez le mythe de la Reine Serpent.",steam,11592,540840
32178,en,Octodad: Dadliest Catch,,"Octodad: Dadliest Catch is a game about destruction, deception, and fatherhood. The player controls Octodad, a dapper octopus masquerading as a human, as he goes about his life. Octodad's existence is a constant struggle, as he must master mundane tasks with his unwieldy boneless tentacles while simultaneously keeping his cephalopodan...",steam,4788,224480
509065,en,Secret Neighbor,,Hello Neighbor Multiplayer. Secret Neighbor is a Multiplayer Social Horror Game where a group of intruders try to rescue their friend from the Neighbor's creepy basement. Only problem is one of the intruders is the Neighbor in disguise.,steam,103295,859570
490919,en,Far Cry: Primal,,"The award-winning Far Cry franchise returns with its innovative open world gameplay, bringing together massive beasts, breathtaking environments, and unpredictable savage encounters. Welcome to the Stone Age, a time of danger and adventure.",steam,13182,371660
67562,en,Freedom Planet,,"Fight your way across the celestial world of Avalice where cats are green, motorcycles drive up walls and monster girls do most of the buttkicking! Freedom Planet is a cartoony, combat-based platform adventure that pits a spunky dragonoid and her friends against an alien attack force.",steam,7116,248310
514425,en,Later Alligator,,"Pat the alligator, a (mostly) harmless and (probably) innocent reptile is at the center of a conspiracy that could bring down the biggest, scariest family in Alligator New York City: his own! Explore the city, meet the Family, and try to save Pat before the clock runs out.",steam,112939,966320
513914,en,Chicken Police,,"A wild tale of love, death, chickens, and redemption! Chicken Police is a buddy-cop noir adventure with a carefully crafted world, a gritty story, and absurd humor. The game mixes classic adventure games with visual novel-style storytelling, presented in a beak-droppingly unique art style.",steam,119323,1084640
