TwitchCategoryId,Language,Name,Synopsis,Summary,Source,IGDBId
27924,fr,Assassin's Creed: Brotherhood,,Maintenant disponible sur Mac ! C'est le moment de rejoindre la Confrérie.,steam,113
513501,,Standoff 2,,"The legendary ""Standoff"" is back in the form of a dynamic first-person shooter! 
 
New maps, new types of weapons, new game modes are waiting for you in this incredible action game, where terrorists and special forces going to engage the battle not for life, but to death.",,126055
8489,fr,Chrono Trigger,,"Ce RPG culte et indémodable revient rempli de nouveautés ! D'un passé oublié à un avenir inconnu et jusqu'à la « Fin des temps », vivez une aventure sans pareille à travers les âges aux côtés de nombreux compagnons pour sauver la planète !",steam,1802
513681,fr,WWE 2K20,,"2K invite les joueurs sur le ring avec WWE 2K20, disponible le 22/10. Vos Superstars préférées de WWE, les Légendes, les membres du Hall of Fame et l'élite de la NXT seront là pour la renaissance de la franchise WWE 2K !",steam,121435
368908,,Haxball,,,,63583
16791,,Ratchet & Clank,,"Ratchet & Clank is a new game based on elements from the original Ratchet & Clank (PS2), featuring more than an hour of new cinematics (including footage from the film) in vibrant 1080p, new locations, weapons, bosses and more. Join Ratchet, Clank, Captain Qwark and new friends as they embark on an intergalactic adventure, and experience the start of an epic friendship (again) on PlayStation 4.",,1289
515154,,Drake Hollow,,"Team up with friends to build and defend villages of vegetable folk from deadly feral beasts in the blighted world of The Hollow. Explore, gather, and fight! Can you craft the perfect village?",,125630
9954,fr,EverQuest,,"Welcome to EverQuest ® - the online game that started it all! No other MMO matches EverQuest's sheer content, now with 25 expansions and countless updates. EverQuest is free-to-play.",steam,282
499046,fr,Reigns: Her Majesty,,"Reigns: Her Majesty est la suite de Reigns, le jeu culte dans lequel balayer une carte vers la droite ou la gauche peut changer le destin d'un souverain.",steam,55106
490537,fr,Layers of Fear,,"Layers of Fear est un jeu d'horreur psychédélique à la première personne, très orienté vers l'histoire et l'exploration. Les joueurs contrôlent un peintre dont le seul but est de terminer son Grand œuvre.",steam,12482
509541,,Luigi's Mansion 3,,"Luigi embarks on a dream vacation with Mario and friends upon receiving an invitation to a luxurious hotel. However, his dream quickly becomes a nightmare when King Boo reveals everything had been a ploy to capture Mario and friends. With the assistance of Professor E. Gadd once again, the reluctant and cowardly hero Luigi traverses up and down treacherous floors of the now-ominous hotel on a quest to save them.",,109455
11282,fr,Final Fantasy VIII,,"C’est la guerre. La superpuissance Galbadia a déclaré la guerre à Dollet, un pays dont l'école militaire abrite deux fortes personnalités : Seifer le colérique, et Squall Leonhart, un grand solitaire. À l’image de Galbadia et Dollet, ils sont en constante opposition.",steam,425
18933,fr,Bayonetta,,Le chef-d'œuvre d'action mondialement célèbre de PlatinumGames débarque enfin sur PC. Plongez dans une action délirante en 60 FPS dans des résolutions HD débloquées. La technique de jeu ultime : être méchant n'a jamais fait autant de bien.,steam,2136
507007,,MX Simulator,,Mx Simulator,,21182
8420,fr,The Lion King,,"Disney The Lion King brings to life the majesty and mystery of Africa through the tale of Simba, a lion cub faced with the challenging transition to maturity. Now, you too can be part of the adventure!",steam,3166
27602,,Pokémon Black/White,,"Pokémon Black Version and Pokémon White Version are the primary paired versions of Generation V.
Black and White follow the trends set up by previous games in the series. Two player characters (one male and one female) travel a new region, Unova, on their Pokémon journeys. This region is inhabited by various Pokémon, and unlike before, none of those available prior to Generation V can be obtained before completing the main story by defeating Team Plasma.
The games' names were revealed on the official Japanese Pokémon website on April 9, 2010, and scans from the subsequent issue of the magazine leaked the following day, April 10.
Pokémon Black and White are followed in 2012 by two sequels, Pokémon Black 2 and White 2, which are set two years after the events of Black and White. Black 2 and White 2 are the second and final paired versions of Generation V.",,1521
490701,,Yakuza 6: The Song of Life,,"How far will you go for family? Hoping to quietly settle down after a brief stint in prison, reformed yakuza Kazuma Kiryu returns to find danger surrounding the lives of those he values most.",,12527
17189,,Mario Kart: Double Dash!!,,"The Mushroom Kingdom just got a whole lot more hectic as Mario and friends double up for furious kart racing. This time around, each kart holds two racers that can switch places at any time, so choose from a huge cast of favorites and pair them up any way you see fit. The character in front handles the driving duties, while the character in the rear doles out damage with six normal items and eight special items that only specific characters can use. Get ready for some intense multiplayer mayhem with your favorite characters, including Mario, Luigi, Donkey Kong, Peach, Bowser, and Koopa.",,2344
490425,fr,Empyrion - Galactic Survival,,"Empyrion - Galactic Survival est un monde 3D ouvert, une aventure de survie spatiale dans laquelle vous pouvez naviguer à travers l'espace et attérrir sur les planètes. Construisez, explorez, combattez et survivez dans une galaxie hostile pleine de dangers cachés.",steam,19249
27733,fr,Before Your Eyes,,"Cap sur une aventure narrative à la 1re personne, où vous faites progresser l'histoire en clignant des yeux dans le monde réel. Grâce à cette technique, vous serez en immersion totale dans un monde de souvenirs, à la fois heureux et déchirants, tandis que votre vie défilera devant vos yeux.",steam,91477
503561,,Dissidia Final Fantasy Opera Omnia,,"Unlike most Final Fantasy games, Dissidia is more of a fighting game rather than a classic role playing game. It still keeps the complex story, character level-up and customization though. The game features main characters from the other Final Fantasy titles, two from each title (the protagonist and the antagonist). The plot revolves around the battle of the two gods, Cosmos and Chaos. The protagonists will form teams in order to fight through Chaos' armies and find their crystals which will later be used to destroy Chaos. Each character has his own campaign to go through at the end of which a crystal will be collected. 
 
The game also features a single fight and an arcade mode where the player will be able to choose his fighter and the opponent (opponents are automatically chosen by the game if playing in arcade mode though). All of the character's experience and skills received through the campaign are saved for the other game modes (and vice-versa, for example: if Cloud had a level equal to 12 when completing the campaign, he will also appear to have the same level when viewing him in the character roster in Arcade or Quick Battle mode). 
 
Another feature is that the items you find during the campaign belong to you, the player. That means you can move items from a character to another. The game also features extra content such as villains, costumes etc. which can be unlocked by using PP. You get such points from each fight and completed campaign.",,24400
493280,fr,Rec Room,,"Rec Room is the best place to build and play games together. Party up with friends from around the world to chat, hang out, explore MILLIONS of player-created rooms, or build something new and amazing to share with us all! Rec Room cross plays on everything from phones to VR headsets. Join the club!",steam,32617
516624,fr,Amnesia: Rebirth,,"Une nouvelle plongée dans les ténèbres par les créateurs de la série emblématique Amnesia. Un périple atroce à travers la désolation et le désespoir, qui explore les limites de la résilience humaine. Mode aventure disponible pour profiter de l’histoire et de l’aventure sans la partie horreur.",steam,131785
506430,fr,Trials Rising,,"La série Trials revient avec l'action débridée et la physique ultra pointue qui ont fait son succès. Avec ses nouvelles pistes dans des lieux emblématiques du monde entier et ses nouveaux modes compétitifs, Trials® Rising est le meilleur à ce jour.",steam,103316
497411,,Forza Motorsport 7,,"Forza Motorsport 7 immerses players in the exhilarating thrill of competitive racing. From mastering the new motorsport-inspired campaign to collecting a wide range of cars to experiencing the excitement of driving at the limit, this is Forza reimagined.",,36872
1654,,Gothic II,,"Gothic II is a role-playing video game and the sequel to Gothic, by the German developer Piranha Bytes. It was first released on November 29, 2002 in Germany, with North America following almost one year later on October 28, 2003. The game was published by JoWooD Entertainment and Atari.",,2262
110748,,Dragon's Dogma: Dark Arisen,,"Dragon’s Dogma: Dark Arisen contains all the content from the original Dragon’s Dogma plus the additional content from its sequel, including the Bitterblack Isle area, filled with challenging new enemies and quests, and additional high level weapons and armour sets. Along with its stunningly high resolution graphics and full Steam platform support, this is the ultimate franchise experience for PC players. 
 
Set in a huge open world, Dragon’s Dogma: Dark Arisen presents a rewarding action combat experience. Players embark on an epic adventure in a rich, living world with three AI companions, known as Pawns. These partners fight independently, demonstrating prowess and ability that they have developed based on traits learnt from each player. PC users can share these Pawns online and reap rewards of treasure, tips and strategy hints for taking down the terrifying enemies. Pawns can also be borrowed when specific skills are needed to complete various challenging quests.",,3968
28867,fr,Vindictus,,"Dive into stylish, bloody combat with Vindictus, one of the most brutal action RPGs.",steam,7887
490919,fr,Far Cry: Primal,,"La franchise à succès Far Cry revient avec un gameplay innovant en monde ouvert, rempli d'énormes bêtes, d'environnements incroyables et de rencontres sauvages. Bienvenue dans l'Âge de Pierre, une époque extrêmement dangereuse.",steam,13182
489567,fr,Five Nights at Freddy's 4,,"In this last chapter of the Five Nights at Freddy's original story, you must once again defend yourself against Freddy Fazbear, Chica, Bonnie, Foxy, and even worse things that lurk in the shadows.",steam,11583
21842,,Dragon Quest II: Luminaries of the Legendary Line,,"This game allows the player to control more than one character, and it is the first one in the Dragon Quest series to do so. The player controls his or her characters as they move in the game world. They can search treasure chests, talk and trade with villagers, equip weapons and armor, and cast spells.",,1813
33175,fr,South Park: The Stick of Truth,,"From the perilous battlefields of the fourth-grade playground, a young hero will rise, destined to be South Park’s savior. From the creators of South Park, Trey Parker and Matt Stone, comes an epic quest to become… cool. Introducing South Park™: The Stick of Truth™.For a thousand years, the battle has been waged.",steam,1262
2128929587,fr,Radio Station,,Radio Station is a single-player first-person game in which you have to get out of the existing situation.,steam,132772
493048,,Fate/Grand Order,,"Fate/Grand Order is an online RPG set in the Fate/stay franchise, for iOS and Android.",,24493
706285090,fr,League of Maidens,,"League of Maidens® est un jeu d'action RPG en ligne GRATUIT POUR JOUER avec de belles femmes avec des armes et des super pouvoirs par le studio indépendant Maiden Gaming. Caractéristiques: Quêtes, batailles, personnalisation, pose et partage de personnages, poses, scènes et photos 4K.",steam,38786
17179,fr,Star Wars: Knights of the Old Republic,,Choisis ton chemin. Nous sommes quatre mille ans avant l'Empire Galactique et des centaines de Chevaliers Jedi sont tombés au combat contre les impitoyables Sith. Vous êtes le dernier espoir de l'Ordre Jedi. Pouvez-vous maîtriser l'incroyable puissance de la Force pour votre quête et sauver la République ?,steam,116
19589,fr,L.A. Noire,,"Un thriller sombre et violent, avec comme toile de fond Los Angeles des années 1940.",steam,109
489069,fr,We Happy Few,,"We Happy Few est un jeu d’action/aventure qui se déroule dans une Angleterre des années 60 alternative, au sein d’une ville rétrofuturiste ravagée par la drogue. Cachez-vous, battez-vous et fondez-vous dans la foule pour échapper à ce monde délirant et obsédé par la Joy.",steam,9182
17324,fr,The Witness,,"Vous vous réveillez seul, sur une île étrange remplie d'énigmes qui vous mettront à l'épreuve et vous surprendront.",steam,5601
27149,,Kahoots,,The confused Kahoots need to find their way to their destination without being bothered by the cranky Cardborgs. Kahoots is a 50 level puzzle game where you swap tiles which form the floor of the levels to help your Kahoot to avoid obstacles and get to the exit.,,42823
519492,fr,Medieval Dynasty,,"Chassez, survivez, construisez et dirigez dans un Moyen-Âge impitoyable : créez votre propre dynastie médiévale et assurez sa prospérité… ou mourez en essayant !",steam,121998
514207,,The Dark Pictures Anthology: Little Hope,,"Trapped and isolated in the abandoned town of Little Hope, 4 college students and their teacher must escape the nightmarish apparitions that relentlessly pursue them through an impenetrable fog.",,122120
504412,,Clix,,,,97990
508696,fr,Bladed Fury,,"An action game set in the Ancient China, bringing players addictive experiences with its unique Chinese traditional art-style and sound design.",steam,108787
490379,fr,Tom Clancy's Ghost Recon: Wildlands,,Formez une équipe de 4 Ghosts avec 3 amis et profitez de la meilleure expérience Tom Clancy’s Ghost Recon® Wildlands : le nouveau jeu de tir se déroulant dans un monde ouvert gigantesque et immersif.,steam,11171
33437,fr,Resident Evil 6,,"Mêlant action et survival horror, Resident Evil 6 s'annonce comme l'expérience horrifique de 2013.",steam,1082
510577,fr,Skater XL,,"Experience unparalleled board control and responsiveness while you skate iconic real-world skate spots. This is the evolution of skateboarding gameplay. With Independent Foot Control and unique physics-based gameplay, skate gamers finally have the expressive controls they have always dreamed of.",steam,113175
68018,fr,Elsword,,"Elsword is a free-to-play, online action RPG that uses classic side-scrolling game mechanics in an immersive manga inspired world.",steam,19133
502918,fr,Two Point Hospital,,"Concevez de splendides hôpitaux, soignez d'étranges maladies et gérez des employés difficiles tandis que vous étendez votre organisation naissante dans tout le Two Point County.",steam,82117
1270,,Rubik's Cube,,"The official Rubik's Cube game is here! Play anywhere, anytime on the most authentic digital representation of the Rubik's Cube available. Rubik's Cube is a 3-D combination puzzle invented in 1974 by Hungarian sculptor and professor of architecture Ernő Rubik.",,71210
515156,,Tell Me Why,,"Tell Me Why is the latest narrative adventure game from DONTNOD Entertainment, the studio behind the beloved franchise, Life is Strange. In this intimate mystery, twins Tyler and Alyson Ronan use their supernatural bond to unravel the mysteries of their loving but troubled childhood in beautiful small-town Alaska.",,125628
495582,fr,Late Shift,,"Late Shift est un thriller FMV à enjeux élevés. Contraint à participer à un hold-up brutal à Londres, vous devez choisir votre propre aventure dans cette expérience interactive cinématographique avec des scénarios adaptables qui mènent à l'une des sept dénouements. Vos décisions vous appartiennent.",steam,27717
510609,,Cyber Hunter,,"Cyber Hunter is a next-generation, competitive sandbox mobile game. It's packed with a host of different elements, including survival, shooting, exploration, skills and much more, even including parkour! In short, it's a brand new gaming experience. The game tells the story of our future, after brain-computer interfacing technology has become highly advanced and human civilization has experienced another evolutionary leap, during which, great events have begun to unfold. Justice faces off against evil. The old stands against the new. And forces of conservatism clash with radicalism. 
In this virtual world, all our heroes and heroines have acquired a “super power” through the help of quantum droids – the ability to turn quantum cube energy into any tactical support device they need. From Optical Camouflage to Quantum Barriers, from a detector that alerts you of approaching enemies, to a medical instrument that heals squad mates; anything and everything can be built, by you, and that's not all. You can choose whatever skills you think will help your strategy the most in any battle. 
We've even created a vertical combat concept. With parkour features including climbing, gliding, and rolling, players can experience vertical battles on a variety of terrain, including mountains, swamps and deserts. In this game, the arena that hosts your battles are not just a huge, flat map, but a world where you can fly in the sky and move underground. We have also created a number of exploration points scattered throughout the world. Here, you can explore temples in the desert with a chance of finding E-Cores to unlock new skills and weapons. Amid mounds of destroyed robots, you can also find gloves that greatly increase your climbing speed.",,117145
2399,fr,The Dig,,"An asteroid the size of a small moon is on a crash course toward Earth. Once the wayward asteroid is nuked into a safe orbit, a trio conducts a routine examination of the rocky surface. What they uncover is anything but routine.",steam,207
25367,fr,Dungeon Fighter Online,,"Get ready for the ultimate brawl! Dungeon Fighter Online is a classic beat-em up 2D action game with an epic storyline and RPG elements! Choose from 14 diverse classes, and unravel ancient mysteries as you punch, slash, shoot, or summon your way to victory!",steam,26606
506491,fr,CRSED: F.O.A.D.,,"CRSED: F.O.A.D - est un MMO last-man-standing de tir avec un armement réaliste, des éléments de forces mystiques mortelles et de super-pouvoirs incroyables!",steam,103381
495122,fr,State of Decay 2,,Les morts se sont relevés et la civilisation s’est effondrée. Votre petit groupe de survivants doit récolter des ressources dans un monde ouvert et construire une base qui puisse résister à des hordes de zombies dans ce jeu hybride d’action/statégie/simulation.,steam,19541
18814,fr,The Sims 3,,Nouveau contenu pour The Sims 3 maintenant disponible !,steam,260
118198,fr,Assassin's Creed IV: Black Flag,,"The year is 1715. Pirates rule the Caribbean and have established their own lawless Republic where corruption, greediness and cruelty are commonplace.Among these outlaws is a brash young captain named Edward Kenway.",steam,1970
26881,fr,Grim Dawn,,"Enter an apocalyptic fantasy world where humanity is on the brink of extinction, iron is valued above gold and trust is hard earned. This ARPG features complex character development, hundreds of unique items, crafting and quests with choice &amp; consequence.",steam,1907
504389,fr,The Beast Inside,,"The Beast Inside est une version unique et captivante du thriller et du jeu d'horreur de survie. Plongez au cœur d'une histoire pleine de secrets longtemps enfouis, de tragédies personnelles et de folie. Incarnez deux protagonistes liés par un sombre héritage.",steam,88116
505705,fr,Noita,,"Noita est un roguelite d'action magique dans un monde où chaque pixel est simulé physiquement. Combattez, explorez, faites fondre, brûlez, gelez et évaporez tout sur votre chemin dans un monde entièrement destructible avec des sorts que vous aurez créés. Ou bien faites le maximum de bêtises !",steam,52006
502007,fr,First Feudal,,"Devenez un véritable seigneur féodal : commencez par un petit village et construisez-le pour en faire un château impénétrable. Vous devrez repousser les raids ennemis : cachez-vous derrière des murs épais, attirez vos ennemis dans des pièges et dirigez vos paysans sur le champ de bataille.",steam,75813
1200871695,,The Last of Us Remastered,,"Winner of over 200 game of the year awards, The Last of Us has been remastered for the PlayStation®4. Now featuring higher resolution character models, improved shadows and lighting, in addition to several other gameplay improvements. 
 
Abandoned cities reclaimed by nature. A population decimated by a modern plague. Survivors are killing each other for food, weapons whatever they can get their hands on. Joel, a brutal survivor, and Ellie, a brave young teenage girl who is wise beyond her years, must work together if they hope to survive their journey across the US. 
 
The Last of Us: Remastered includes the Abandoned Territories Map Pack, Reclaimed Territories Map Pack, and the critically acclaimed The Last of Us: Left Behind Single Player campaign. 
 
PS4 PRO ENHANCED: 
- PS4 Pro HD 
- Dynamic 4K Gaming 
- Greater Draw Distance 
- Visual FX 
- Vivid Textures 
- Deep Shadows 
- High Fidelity Assets 
- HDR",,1009
511385,,Roblox Studio,,,,130420
504798,,FIFA Online 4,,"FIFA Online 4 is a free-to-play massively multiplayer online football game. It was released in various Southeast Asian countries, starting with South Korea in 2018. An English version has yet to be released.",,93902
17000,,Ninja Gaiden Sigma,,"Ninja Gaiden Sigma, stylized as Ninja Gaiden Σ, is an action-adventure game developed by Team Ninja for the PlayStation 3. It is an enhanced port of Ninja Gaiden, originally released on Xbox in 2004, and is the second expansion to the game after Ninja Gaiden Black. The game was released in the summer of 2007 to very positive reviews. In 2012, a port for the PlayStation Vita, titled Ninja Gaiden Sigma Plus was released on the same day the console launched in Europe and North America.[1",,5972
27101,,Crossfire,,"CrossFire is a first-person shooter that features two mercenary corporations named the ""Black List"" and ""Global Risk,"" fighting each other in an epic global conflict. Players assume the role of either a Black List or Global Risk mercenary, joining an online team that must work together to complete objective-based scenarios. With the exception of the Zombie mode and Wave mode, each mode can support a maximum of 16 players (except Wave mode), each divided into an 8-man team (5 for Wave mode).

There are more than ten online modes: Team Death Match, Search and Destroy, Elimination Match, Ghost Mode, Free-For-All, Mutation Mode, Escape Mode, Hero Mode, Hero Mode X, Zombie mode, Elite mode, Wave Mode, Shadow Mode, Biochemical Knight Mode, Ghosts vs Mutants, RPG/Melee Mode, Soccer Mode, Light Mode, and Super Soldiers TD.

Based on their performance in-game, players will receive experience points and be promoted through various Military Ranks. The lowest rank is trainee first class, the highest is Marshall. Players also have the ability to customize their character's equipment and appearance through CrossFire's in-game item shop and from the Mall in the website.

CrossFire is free to download and playable online. It has a free currency which is called Game Points (GP), which are earned through playing and completing matches, buying premium items that grant bonus GP, or fulfilling certain missions. Premium and special items like modified weapons can only be bought using points which are obtained using real money in the form of cards or online transactions. The content and the name of the points tends to vary from version to version.",,9739
513794,fr,Apsulov: End of Gods,,"Dans cette future horreur viking, vous vous réveillez dans un sanctuaire d'acier et de béton, construit pour rechercher et exploiter les mondes d'Yggdrasil, et pour abriter un artefact, enterré dans la terre depuis des lustres. Dévoilez les secrets de la mythologie, les artefacts et les royaumes d'Yggdrasil à Apsulov : La fin des dieux.",steam,111130
33882,fr,FTL: Faster Than Light,,Ce jeu de simulation spatiale de type rogue-like vous permet de piloter votre vaisseau dans une galaxie générée aléatoirement où vous pourrez vous couvrir de gloire... si vous parvenez à éviter la défaite.,steam,3075
517401,,The Medium,,"Discover a dark mystery only a medium can solve. Explore the real world and the spirit world at the same time. 
 
Use your psychic abilities to solve puzzles spanning both worlds, uncover deeply disturbing secrets, and survive encounters with The Maw - a monster born from an unspeakable tragedy. 
 
The Medium is a third-person psychological horror game that features patented dual-reality gameplay and an original soundtrack co-composed by Arkadiusz Reikowski and Akira Yamaoka.",,133308
493277,fr,Battlerite,,"BATTLERITE​ est un jeu de combat en arène intense. Découvrez le mélange unique d'un jeu de tir en vue de dessus et d'un jeu de combat effréné, et défiez vos amis et vos ennemis dans un combat de réactions. L'arène vous attend !",steam,23193
