TwitchCategoryId,Language,Name,Synopsis,Summary,Source,IGDBId
497467,fr,Monster Hunter: World,,Bienvenue dans le Nouveau Monde ! &quot;Monster Hunter: World&quot; offre une dimension de jeu et une liberté sans commune mesure avec les précédents épisodes. Les chasseurs pourront utiliser un arsenal varié pour chasser un bestiaire unique dans un monde fabuleux !,steam,36926
512968,,Zombie Army 4: Dead War,,"Hitler’s hordes are back for more in this spine-chilling shooter from the makers of Sniper Elite 4! Abominable occult enemies, epic weapons and a harrowing new campaign for 1-4 players await in 1940s Europe, as you fight to save humankind from undead Armageddon.",,119234
73914,,Clash of Clans,,"Clash of Clans is an addictive mixture of strategic planning and competitive fast-paced combats. Raise an army of Barbarians, War Wizards, Dragons and other mighty fighters. Join a clan of players and rise through the ranks, or create your own Clan to contest ownership of the Realm.",,5589
8645,,Resident Evil 2,,"Resident Evil 2, known in Japan as biohazard 2, is a sequel to the first Resident Evil title. It was originally released in 1998 for the Playstation - however as of 2016, a remake is the in works for XB1, PS4 and PC. Set in Raccoon City, you take on the role of Leon S. Kennedy and Claire Redfield as you try to escape the city, which has come under a zombie virus thanks to Umbrella Corporation. The gameplay of Resident Evil 2 focuses on a combination of puzzle solving and combat.",,880
504463,,Tom Clancy's The Division 2,,"The Division 2 is an action-shooter RPG set in an open-world. Play in co-op and PvP modes that offer more variety in missions and challenges, new progression systems with unique twists and surprises, and fresh gaming innovations to engage players for years to come.",,90099
495811,fr,SCUM,,"SCUM aims to evolve the multiplayer open world survival game with unprecedented levels of character customization, control and progression, where knowledge and skills are the ultimate weapons for long-term survival.",steam,31712
68000,fr,The Evil Within,,"Développé par Shinji Mikami, créateur de la série phare des Resident Evil, et la talentueuse équipe de Tango Gameworks, The Evil Within incarne la quintessence du Survival Horror. Découvrez un univers inquiétant alors que vous tentez d’échapper à une machination retorse qui ne peut exister que dans les environnements les plus terrifiants.",steam,4786
1903748926,fr,Parasite,,Parasite is a non-linear retro platformer with a mix of action and puzzles. The player controls an alien worm wanting to get rid of a human space colony on his planet. There are multiple shapes to unlock and to switch between to facilitate the navigation and sabotage the complex.,steam,33748
496902,fr,Slay the Spire,,"En fusionnant les jeux de cartes avec les roguelikes, nous sommes arrivés à créer le jeu de cartes solo le plus intéressant possible. Construisez votre deck, rencontrez toutes sortes d'ennemis bizarres, découvrez des reliques aux pouvoirs immenses, et éradiquez la tour!",steam,40477
503116,fr,Beat Saber,,"Beat Saber est un jeu de rythme en VR où vous devez trancher les notes d'une musique entraînante qui arrivent vers vous, au sein d'un univers futuriste.",steam,83731
510590,fr,Hades,,"Défiez le dieu des morts et frayez-vous un chemin hors des Enfers dans ce rogue-like en mode dungeon crawler développé par les créateurs de Bastion, Transistor et Pyre.",steam,113112
65876,fr,Cyberpunk 2077,,"Cyberpunk 2077 est un jeu d’action-aventure en monde ouvert qui se déroule à Night City, une mégalopole obsédée par le pouvoir, la séduction et les modifications corporelles. Vous incarnez V, mercenaire hors-la-loi à la recherche d’un implant unique qui serait la clé de l’immortalité.",steam,1877
511850,,Saint Seiya : Awakening,,"Saint Seiya : Awakening is a mobile game masterpiece which perfectly restoring the classic of the Japanese comics. 12 Golden Saints and all classic characters are back to the Sanctuary and waiting for your summon. 
 
Freely set up an exclusive team, flexible match strategy to win! 
 
Breakthrough the common gameplay and bring you an enjoyable gaming experience! 
 
In addition, the beautiful game graphics, cool combat effects with the lineup of top Japan Character Voice, brings you the unique audio-visual enjoyment! When the classic theme song sounds on, the cosmo power will burn you up again...",,122667
508391,,Krunker,,"An easy to get into fully moddable First Person Shooter with advanced movement mechanics. Fully Customizable with Mods, Custom Maps and Thousands of Items to Unlock.",,109096
515486,fr,First Class Trouble,,First Class Trouble est un jeu de fête où les joueurs doivent travailler ensemble et les uns contre les autres pour survivre à un désastre. Le but est d'arrêter un A.I.,steam,121898
9455,,Super Mario Bros. 3,,"Super Mario Bros. 3, the third entry in the Super Mario Bros. series and Super Mario franchise, sees Mario or Luigi navigate a nonlinear world map containing platforming levels and optional minigames and challenges. The game features more diverse movement options and new items alongside more complex level designs and boss battles.",,1068
369380,fr,Dying Light,,"Jeu d'action-survie en vue subjective dans un open-world post-apocalyptique grouillant de zombies dévoreurs de chair. Explorez une ville dévastée par un mystérieux virus. Cherchez des ravitaillements, fabriquez des armes et affrontez les hordes d'infectés.",steam,3042
752123219,,Wanted Raccoon,,"Wanted Raccoon is a 3rd person raccoon simulator with a storyline and extensive research space. Steal food, ride a skateboard, be inconspicuous, fight with people, create equipment, upgrade skills, lead resistance and find a kidnapped family!",,144087
13332,,Pokémon FireRed/LeafGreen,,"Pokémon FireRed Version and Pokémon LeafGreen Version are a pair of core series Generation III games that are set in the Kanto region. They were released in Japan on January 29, 2004, in North America on September 9, 2004, in Australia on September 23, 2004 and in Europe on October 1, 2004.
As the first remakes in the Pokémon franchise, the games revisit the original pair of Pokémon games, Pokémon Red and Green Versions, and so feature all of the characters, plot elements, and challenges of them, but with several important upgrades to bring them up to speed with other Generation III games.
The Game Boy Advance Wireless Adapter was initially included with the games when they were first released, eliminating the need for Game Link Cables when trading between the two games (and later Pokémon Emerald Version). In later copies, it was sold separately.
FireRed and LeafGreen went on to become the second best-selling games of the Game Boy Advance, only behind Pokémon Ruby and Sapphire Versions. They also received Nintendo's Player's Choice awards.",,1561
508289,fr,WWE 2K19,,"WWE 2K19, le dernier opus de la série de jeux vidéo de la WWE, revient avec la Superstar AJ Styles en couverture ! Profitez d'une tonne d'options de créations, de types de matchs et bien plus !",steam,102805
11678,,Onimusha 3: Demon Siege,,"Onimusha 3 is the third game of the Onimusha series. The story focuses on the returning hero, swordsman Hidemitsu Samanosuke Akechi, who is in his quest to defeat his nemesis, Nobunaga Oda, who wishes to conquer Japan with his army of demons known as Genma. However, Samanosuke changes places with a French officer from the future named Jacques Blanc, and both have to adapt to their new worlds to get rid of Nobunaga and the Genma.

The game retains elements from previous games in the franchise including the use of multiple special weapons in order to fight enemies and absorb their energy to enhance the weaponry. This time the player primarily controls both Samanosuke and Jacques in separate scenarios. The two are able to exchange items in order to solve puzzles. The development from this game started after the release of the PlayStation 2 which allowed the team to work on a 3D engine to design 3D backgrounds. In order to appeal to the Western market, the team set this game in Paris and chose French actor Jean Reno to portray Jacques.

Onimusha 3 has been generally well received by publications for video games. Most of the writer's praise focused on the improved controls and the use of a 3D engine that allowed better combat and visuals, respectively. The game also generated good sales with over 1.5 million copies sold as of May 2008.",,11758
512989,fr,Spiritfarer,,"Spiritfarer® est un jeu de gestion cosy sur le thème de la mort, dans lequel vous incarnez une passeuse d’âmes. Construisez un bateau pour explorer le monde, prenez soin de vos esprits et guidez-les au long des mers mystiques jusqu’à l’au-delà.",steam,119304
21934,,Star Wars: The Old Republic,,"Step in to the center of your own Star Wars story as you choose your path down the light or dark side of the Force. Your choices have impact not only on your story but on those who join you along the way. Each choice you make can change how your story unfolds including unexpected story twists or devastating consequences that impact you and your Companions. Play as one of 8 legendary Star Wars classes include Jedi, Sith, Smuggler, Trooper and more – this is your story and you decide how you want to build your reputation and influence across the galaxy as you join in epic adventures and challenging missions on the ground and in space!",,114
499463,fr,Getting Over It,,A game I made for a certain kind of person. To hurt them.,steam,72373
9611,,The Witcher,,"Based on the novel series by Andrzej Sapkowski, The Witcher follows Geralt of Rivia, an amnesiac witcher (problem solver and slayer of monsters) whose home, the Kaer Morhen citadel, is besieged by an organization called the Salamandra, who steal their valuable potions and get away. Throughout the game, Geralt must resolve people's moral dilemmas, connect the dots of his past and track down the Salamandra.",,80
490177,fr,Blood Bowl 2,,"Blood Bowl 2 réunit Warhammer et football américain dans un cocktail détonnant de stratégie en tour par tour, d’humour et de brutalité, adapté du célèbre jeu de plateau de Games Workshop.",steam,6059
518222,,Crash Bandicoot 4: It's About Time,,"The devious villains Neo Cortex and Dr. N. Tropy have finally escaped their interdimensional prison, leaving an evil scientist sized hole in the universe. Now they’ve got their eyes set on not only simply conquering this dimension, but ALL dimensions, and it’s up to Crash and Coco to save the day. N. Sanity Beach is where Crash’s adventure first started, and where it begins in Crash 4. But there have definitely been changes since players first saw N. Sanity Beach all those years ago, and throughout Crash 4 you’ll notice changes to gameplay and even the art style.",,135254
495764,fr,Golf It!,,"Golf It! is a multiplayer Minigolf game with focus on a dynamic, fun and creative multiplayer experience. One of the most exciting features is a Multiplayer Editor, where you can build and play custom maps together with your friends.",steam,30099
1964,fr,Call of Duty 4: Modern Warfare,,"Le nouvel opus de l'équipe Infinity Ward, les créateurs de la série Call of Duty®, nous délivrent leur meilleure création jusqu'alors. Call of Duty 4: Modern Warfare vous enrôle et vous fournit les armes les plus puissantes avant de vous envoyer aux 4 coins du globe combattre un ennemi menaçant l'équilibre du monde.",steam,623
489164,fr,Danganronpa V3: Killing Harmony,,"16 nouveaux personnages sont enlevés et emprisonnés dans une école. Certains vont tuer, d’autres mourir, et des punitions seront infligées. Revoyez votre conception de ce qu'est une enquête effrénée aux enjeux de taille en enquêtant sur des meurtres retors et en condamnant à mort vos nouveaux amis.",steam,12579
32207,fr,The Binding of Isaac,,Maintenant 20% Plus Méchant avec la mise à jour gratuite d'Halloween !,steam,2132
126290,,Driveclub,,"DRIVECLUB brings to life the heart and soul of car culture. An incredible, authentic and immersive PS4 driving experience, DRIVECLUB makes you feel the exhilaration of driving the most powerful and beautifully designed cars in the world; all rendered in staggering detail, inside and out as you race them in richly detailed real-world locations alongside your Club.",,1940
14766,,Super Mario Galaxy,,"A 3D platformer and first Wii entry in the Super Mario franchise, Super Mario Galaxy sees Mario jump across planets and galaxies with varying items, enemies, geographies and gravity mechanics in order to reach his enemy Bowser, who has attacked the Mushroom Kingdom and hijacked Princess Peach's castle with her inside.",,1077
11989,,StarCraft,,StarCraft is a strategic game set in a Galaxy far away on multiple planets. It's style and balance between the three antagonistic species it features is unique and appealed to millions.,,230
476269,fr,Yakuza 0,,La série japonaise légendaire de SEGA débarque enfin sur PC. Battez-vous dans les rues de Tokyo et Osaka en incarnant les yakuzas en herbe Kiryu et Majima.,steam,11397
509066,fr,Remnant: From the Ashes,,"Incarnant l'un des derniers survivants, vous devrez lutter en solo ou en groupe avec jusqu'à deux autres joueurs contre des hordes d'ennemis redoutables et des boss épiques pour défendre vos positions, reconstruire et reprendre ce qui a été perdu.",steam,105049
66402,,Battlefield 4,,"Battlefield 4™ is the genre-defining action blockbuster created by DICE, and made from moments that blur the line between game and glory – moments found only in Battlefield. Go to Boot Camp to learn the basics of Battlefield 4's engaging single player and intense multiplayer mode. Here you'll also find intel on Levolution, Commander Mode, Naval Warfare and many more exciting game features.",,1979
91628704,,Dorfromantik,,"Dorfromantik is a peaceful building strategy and puzzle game where you create a beautiful and ever-growing village landscape by placing tiles. Explore a variety of colorful biomes, discover and unlock new tiles and complete quests to fill your world with life!",,134799
497385,fr,Dragon Ball FighterZ,,DRAGON BALL FighterZ is born from what makes the DRAGON BALL series so loved and famous: endless spectacular fights with its all-powerful fighters.,steam,36911
497480,,Detroit: Become Human,,"Detroit: Become Human is an neo-noir thriller. The plot revolves around three androids: Kara, who escapes the factory she was made in to explore her newfound sentience; Connor, whose job it is to hunt down deviant androids like Kara; and Markus, who devotes himself to releasing the androids from servitude. The characters may survive or perish depending on the choices that are made, which serve to shape the story as customised by the player.",,14362
493551,fr,Conan Exiles,,"Jeu de survie multijoueur en ligne, désormais agrémenté de montures et de combat monté, dans le monde de Conan le barbare. Survivez dans un monde immense de type bac à sable, construisez votre propre maison, fondez un royaume et dominez vos ennemis, en mode solo ou multijoueur.",steam,16999
498289,fr,CarX Drift Racing Online,,"Avec CarX Drift Racing, éveillez le pilote qui sommeille en vous et maîtrisez l'art du drift ! Jouez avec des amis, réglez votre bolide et brûlez de la gomme !",steam,51443
512563,fr,TRIALS OF FIRE,,"A Tactical, Deck-Building Roguelite. Choose 3 Heroes and adventure into a post-Cataclysmic wasteland. Engage enemies in a unique meld of card-play and tactical, positional combat. Level up and scavenge what you can to customise your decks and build a party to take on any challenge!",steam,116992
19731,fr,Portal 2,,La &quot;Perpetual Testing Initiative&quot; a été étendue pour vous permettre de concevoir des puzzles coopératifs pour vous et vos amis !,steam,72
65663,fr,Company of Heroes 2,,"Plongez dans le RTS ultime sur la Seconde Guerre Mondiale avec le jeu COH 2 et ses extensions. Ce pack inclut le jeu d'origine, pour lequel vous pouvez ensuite acheter The Western Front Armies, Ardennes Assault ou encore The British Forces. Voir infos additionnelles ci-dessous.",steam,1369
9446,,League Challenge,,,,78820
8855,,Need for Speed: Underground 2,,"Need For Speed Underground 2 takes place in Bayview after the events of Need for Speed: Underground. The prologue begins with the player driving in a Nissan Skyline R34 in Olympic City (though the racing scenes are actually in Bayview), the setting of NFS:UG. He then receives a race challenge from a rather ominous personality who offers him a spot on his crew, but ""won't take 'no' for an answer."" The player races off — despite Samantha's warnings — only to be ambushed by a mysterious driver in a rage that totals his Skyline. The driver, who has a unique scythe tattoo, makes a call confirming the accident, and the flashback fades out.",,97
24193,fr,Left 4 Dead 2,,"Situé dans un univers post-apocalyptique peuplé de zombies, Left 4 Dead 2 est la suite très attendue du meilleur jeu de coop de 2008. Ce jeu de tir d'action et de coop à la première personne entraîne votre équipe dans les cimetières et marécages, de Savannah à La Nouvelle-Orléans en 5 campagnes.",steam,124
65950,,Beyond: Two Souls,,"This is an action game in which players assume the role of Jodie Holmes and her invisible companion ""Aiden"" through fifteen years of Jodie's life. From a third-person perspective, players control Jodie through fully interactive environments, choosing a variety of action-, dialogue-, and decision-paths based on on-screen prompts. Some choices can lead to depictions of violence: Jodie attacking assailants with punches, kicks, and various objects (e.g., tree branches and knives; impaling an enemy with a pipe). As the character Aiden, players solve puzzles, manipulate objects and attack (e.g., strangulation) Jodie's assailants. Players can also use Aiden to possess enemies and perform violent acts (e.g., shooting fellow SWAT members; crashing vehicles; performing self-inflicted gunshot wounds). Some of these sequences are accompanied by blood-splatter effects. In one cutscene, a bound character's eye is cut out during an interrogation—the act is obscured by a character's back. One prolonged bar sequence depicts three men attempting to rape a woman; players control Aiden and interact with objects to stop the assailants. Another sequence depicts a character propositioning a woman to perform fellatio. The game includes depictions of the central character drinking beer and smoking a marijuana in a party setting – screen distortion occurs during theses sequences. The words “f**k” and “sh*t” can be heard in the dialogue.",,1342
489767,fr,XCOM 2,,"XCOM 2 est la suite de XCOM: Enemy Unknown, le jeu de stratégie à succès. Vingt années se sont écoulées depuis que l'humanité a perdu la guerre contre l'envahisseur extraterrestre, et un nouvel ordre mondial a été imposé sur Terre. Après des années passées dans l'ombre, XCOM va devoir renaître et éliminer la menace extraterrestre.",steam,10919
2126,,Wheel of Fortune,,Spin the wheel along with Pat Sajak and Vanna White on the virtual version of America’s Game!,,69177
497434,fr,Total War: Warhammer II,,"Suite du titre à succès Total War: WARHAMMER, Total War: WARHAMMER II présente une campagne à couper le souffle, constituée d'exploration, d'expansion et de conquête à travers le Nouveau Monde.",steam,28028
511353,,Astral Chain,,"ASTRAL CHAIN, a brand new action game from PlatinumGames, is coming exclusively to Nintendo Switch! As part of a police special task force, it’s up to you to fight against mysterious, alien-like creatures who have invaded the world.",,115283
503446,fr,Star Wars Jedi: Fallen Order,,"Une aventure galactique vous attend dans STAR WARS Jedi: Fallen Order, un nouveau jeu d'action-aventure à la 3e personne, développé par Respawn Entertainment. Un Padawan abandonné doit terminer son entraînement, développer de nouvelles capacités de la Force et apprendre à maîtriser son sabre laser, en gardant une longueur d'avance sur...",steam,74701
417892,fr,Z1: Battle Royale,,"Z1 Battle Royale is a Free to Play, fast-paced, action arcade, competitive Battle Royale. Staying true to its &quot;King of the Kill&quot; roots, the game has been revamped and restored to the classic feel, look, and gameplay everyone fell in love with. Play solo, duos, or fives and be the last ones standing.",steam,18094
19589,fr,L.A. Noire,,"Un thriller sombre et violent, avec comme toile de fond Los Angeles des années 1940.",steam,109
14678,,Lineage: The Blood Pledge,,"In this online RPG of Korean origin, the player can explore the medieval world of Lineage as one of the four available character classes: elf, knight, prince, or wizard. Knights are physical fighters, wizards are proficient in magic, while playing as an elf or a prince require a combination of both. After you create a character, your main goal in the game will be to gain enough experience and to join one of the existent blood pledges, which are equivalent to guilds in other games. As a prince, you can also create your own blood pledge.",,78247
32634,,Pokémon Trading Card Game Online,,"Pokémon Trading Card Game Online (also referred to as Pokémon TCG Online or TCGO) is a downloadable game and the first Pokémon game of the MMOTCG (massively-multiplayer online trading card game) genre. It is based on the Pokémon Trading Card Game or TCG aspect of the Pokémon franchise and follows the same rules. The game was originally released as a browser-based game in March 2011 before being relaunched as a downloadable game in 2012 for the PC and Mac, iPad in 2014, and Android tablets in 2016. It officially emerged from open beta testing in February 2015 but continues to be refined and improved upon on a continual basis. The game is free to download and is accessible to both beginners and experienced players. It is also intended to be used by both adults and children. Players do not need to purchase physical Theme decks or Booster packs from a store in order to play. Players are provided with everything they need, and there are multiple means of earning new cards and other rewards as the game is played.",,24423
6040,,Ninja Gaiden Black,,"In Ninja Gaiden Black you can reprise the role of Ryu Hayabusa, ninja extraordinaire. This sequel to Ninja Gaiden supplies a new story and new missions, plus two more difficulty settings and cinematic cut scenes that provide background about the protagonist. Ninja Gaiden Black also incorporates the additional content from Hurricane Packs 1 and 2 and includes unlockable content such as the original arcade version of Ninja Gaiden.",,5972
488479,fr,Squad,,"Squad is a tactical FPS that provides authentic combat experiences through teamwork, constant communication, and gameplay. It bridges the large gap between arcade shooter and military simulation with 100 player battles, combined arms combat, base building, and a great integrated VoIP...",steam,9495
459064,fr,Cuphead,,"Cuphead, c'est un jeu de plates-formes/action dans la pure veine « run and gun », avec un goût prononcé pour les combats de boss épiques. Inspirés des cartoons américains des années 30, la bande-son et les graphismes ont été créés en respectant scrupuleusement les techniques de l'époque : animation traditionnelle dessinée à la main sur...",steam,9061
11988,fr,Final Fantasy VII,,"À Midgar, une cité contrôlée par le méga-conglomérat Shinra Inc., le réacteur Mako No. 1 a été détruit par le groupe de rebelles AVALANCHE.AVALANCHE fut secrètement crée afin de mener le combat contre la Shinra Inc.",steam,427
28613,,The Legend of Zelda: Ocarina of Time 3D,,"A Nintendo 3DS remaster of The Legend of Zelda: Ocarina of Time (1998), originally for the Nintendo 64, with more up-to-date graphics, streamlined UI, alternative aiming controls, different additional game modes and difficulty tweaks.",,45142
461389,fr,Life is Strange,,"Episode 1 GRATUIT ! Life is Strange est un jeu d'aventure récompensé et encensé par la critique permettant au joueur de remonter dans le temps et modifier le passé, le présent et l'avenir.",steam,7599
509110,fr,Risk of Rain 2,,"Échappez à une planète étrangère chaotique en affrontant des hordes de monstres déchaînés, en solo ou entre amis. Combinez le butin de façon surprenante et maîtrisez chacun des personnages jusqu'à devenir vous-même le chaos que vous craigniez tant lors de votre premier écrasement.",steam,28512
1563114544,fr,Movie World,,"In Movie World you can build your own movie studio. Produce entertaining and glamorous movies. Research new technologies to keep up with the industry. Expand into series, compete with other studios, receive the awards, create franchises and prevail in the movie business.",steam,132349
458443,fr,Alien: Isolation,,"Discover the true meaning of fear in Alien: Isolation, a survival horror set in an atmosphere of constant dread and mortal danger.",steam,4754
6715,fr,DOOM,,"Inclut désormais les cartes, modes de jeux, armes et les trois packs de DLC premium (Unto the Evil, Hell Followed, et Bloodfall), ainsi que les modes Arcade et Photo. Inclut également la dernière Mise à jour 6.66 qui vient enrichir le mode multijoueur et qui améliore son mode de progression.",steam,7351
496253,fr,Quake Champions,,"Quake® Champions est un jeu de tir en arène frénétique, un genre créé par le Quake original il y a 20 ans. Le jeu ajoute une touche de modernité à l'univers sombre de Quake et au multijoueur innovant de Quake III Arena – les Champions, possédant chacun leurs attributs et capacités à maîtriser.",steam,19530
