TwitchCategoryId,Language,Name,Synopsis,Summary,Source,IGDBId
369588,,Mario Kart 8,,"Turn your racing experience upside down! Nintendo’s Mario Kart franchise comes to the Wii U console in full HD, introducing new racing circuit designs and anti-gravity karts that will have players driving upside down. And for the first time, all of Bowser’s seven Koopalings are playable characters-- get a taste of being bad on the race track by playing as Iggy, Larry, Lemmy, Ludwig, Morton, Roy and Wendy. Players will also enjoy a variety of series-favorite features, including the return of 12-player online competitive play, hang-gliders, underwater racing and motorbikes.",,2350
491487,fr,Dead by Daylight,,Dead by Daylight est un jeu d’action multi-joueurs (4 contre 1) qui vous plonge dans une ambiance de film d’horreur. Chaque joueur peut jouer le rôle d’un tueur sanguinaire pendant que les quatre autres tentent de lui échapper en évitant d’être attrapé et tué.,steam,18866
511224,fr,Apex Legends,,"Apex Legends is the award-winning, free-to-play Battle Royale team shooter from Respawn Entertainment. Master an ever-growing roster of legendary characters with powerful abilities and experience strategic squad play and innovative gameplay in the next evolution of Battle Royale.",steam,114795
27471,,Minecraft,,"Minecraft focuses on allowing the player to explore, interact with, and modify a dynamically-generated map made of one-cubic-meter-sized blocks. In addition to blocks, the environment features plants, mobs, and items. Some activities in the game include mining for ore, fighting hostile mobs, and crafting new blocks and tools by gathering various resources found in the game. The game's open-ended model allows players to create structures, creations, and artwork on various multiplayer servers or their single-player maps. Other features include redstone circuits for logic computations and remote actions, minecarts and tracks, and a mysterious underworld called the Nether. A designated but completely optional goal of the game is to travel to a dimension called the End, and defeat the ender dragon.",,121
19619,,Tibia,,"Tibia is one of the oldest and most successful massively multiplayer online role-playing games (MMORPG) created in Europe. In an MMORPG people from all over the world meet on a virtual playground to explore areas, solve tricky riddles and undertake heroic exploits.",,9596
29433,,Dark Souls,,"An action RPG and spiritual sequel to Demon's Souls (2009) in which the player embodies the Chosen Undead, who is tasked with fulfilling an ancient prophecy by ringing the Bells of Awakening in the dark fantasy setting of Lordran, an open world with intricate areas full of beasts, former humans gone hollow, and magical abominations whom the player must overcome in challenging and unforgiving combat.",,2155
3077,,True Crime: New York City,,"Be a good cop or a bad cop in the streetwise action game True Crime: New York City. You can explore the authentically modeled streets of New York City as a police officer tracking down criminals and administering justice. The game features a diverse weapon set, as well as a mixed offering of fighting styles that you can use to take out those who stand in your way. In addition to combat on foot, the game features driving sequences and shootouts. Laurence Fishburne, Christopher Walken, and Mickey Rourke contribute their voice talent to the game as well.",,4215
30921,fr,Rocket League,,"Football et voitures font bon ménage dans cette suite basée sur les lois de la physique du grand classique tant apprécié, Supersonic Acrobatic Rocket-Powered Battle-Cars !",steam,11198
517330,,Assassin's Creed Valhalla,,"In Assassin's Creed Valhalla, become Eivor, a legendary Viking raider on a quest for glory. Explore a dynamic and beautiful open world set against the brutal backdrop of England’s Dark Ages. Raid your enemies, grow your settlement, and build your political power in the quest to earn a place among the gods in Valhalla.",,133004
493959,fr,Red Dead Redemption 2,,"Winner of over 175 Game of the Year Awards and recipient of over 250 perfect scores, RDR2 is the epic tale of outlaw Arthur Morgan and the infamous Van der Linde gang, on the run across America at the dawn of the modern age. Also includes access to the shared living world of Red Dead Online.",steam,25076
27284,,Retro,,"Eight arcade classics 3D-fied. 
Includes: 
Bounce 'n Break 
Bubble Puzzle 
Gobbler 
Hopper 
Laser Command 
Light Racer 
Roids 
Galaxy Warz",,91473
512709,,Call of Duty: Black Ops Cold War,,"The iconic Black Ops series is back with Call of Duty®: Black Ops Cold War – the direct sequel to the original and fan-favorite Call of Duty®: Black Ops. 
 
Black Ops Cold War will drop fans into the depths of the Cold War’s volatile geopolitical battle of the early 1980s. Nothing is ever as it seems in a gripping single-player Campaign, where players will come face-to-face with historical figures and hard truths, as they battle around the globe through iconic locales like East Berlin, Vietnam, Turkey, Soviet KGB headquarters and more. 
 
As elite operatives, you will follow the trail of a shadowy figure named Perseus who is on a mission to destabilize the global balance of power and change the course of history. Descend into the dark center of this global conspiracy alongside iconic characters Woods, Mason and Hudson and a new cast of operatives attempting to stop a plot decades in the making. 
 
Beyond the Campaign, players will bring a Cold War arsenal of weapons and equipment into the next generation of Multiplayer and Zombies experiences. 
 
Welcome to the brink. Welcome to Call of Duty®: Black Ops Cold War.",,137001
21779,,League of Legends,,"League of Legends is a fast-paced, competitive online game that blends the speed and intensity of an RTS with RPG elements. Two teams of powerful champions, each with a unique design and playstyle, battle head-to-head across multiple battlefields and game modes. With an ever-expanding roster of champions, frequent updates and a thriving tournament scene, League of Legends offers endless replayability for players of every skill level.",,115
32399,fr,Counter-Strike: Global Offensive,,"Counter-Strike: Global Offensive (CS: GO) étend le genre du jeu d'action dont Counter-Strike fut le pionnier lors de sa sortie, il y a plus de 12 ans. CS: GO comprend de nouvelles cartes, de nouveaux personnages, de nouvelles armes et met à jour les classiques (de_dust2, etc.).",steam,1372
517174,fr,F1 2020,,"F1® 2020 vous permet pour la 1re fois de créer votre écurie de F1® et d’affronter les écuries et pilotes officiels. Défiez aussi vos amis en écran partagé lors de courses personnalisables, juste pour le plaisir. Affrontez 22 circuits, avec du contenu classique et actualisé.",steam,132205
459931,,Old School RuneScape,,Relive the challenging levelling system and risk-it-all PvP of the biggest retro styled MMO. Play with millions of other players in this piece of online gaming heritage where the community controls the development so the game is truly what you want it to be!,,79824
490292,fr,Dark Souls III,,"Dark Souls continues to push the boundaries with the latest, ambitious chapter in the critically-acclaimed and genre-defining series. Prepare yourself and Embrace The Darkness!",steam,11133
13389,,Age of Empires II,,"Take control of a powerful civilization. Lead them through 1000 years of the Middle Ages to riches and greatness. Will you Intimidate the world into following you by using military force? Rule the world with honor and nobility by using commerce and diplomacy? Or Underhandedly seize power through conspiracy, deception and regicide? There are many paths to power, there can only be one ruler!  
  
Features:  
  
* Travel through time as your civilization evolves from the Dark Age to the Imperial Age  
  
* Construct a rich and thriving empire by trading with allies  
  
* Control and lead military forces with tactical commands  
  
* Go into battle at the side of famous heroes such as Joan of Arc, Barbarossa or William Wallace 
 
Age of Empires II: The Age of Kings is a real-time strategy video game developed by Ensemble Studios and published by Microsoft. Released in 1999 for Microsoft Windows and Macintosh, it is the second game in the Age of Empires series. The Age of Kings is set in the Middle Ages and contains thirteen playable civilizations. Players aim to gather resources, which they use to build towns, create armies, and defeat their enemies. There are five historically based campaigns, which constrict the player to specialized and story-backed conditions. There are three additional single-player game modes, and multiplayer is supported. 
 
Despite using the same game engine and similar code to its predecessor, development of The Age of Kings took a year longer than expected, forcing Ensemble Studios to release Age of Empires: The Rise of Rome in 1998 instead. The design team focused on resolving significant issues in Age of Empires, but noted on release that some problems remained. A Sega Dreamcast version was announced, but cancelled for unknown reasons. An updated high-definition graphics version of the game, Age of Empires II: HD Edition, was released in 2013. The HD Edition includes the original game and the expansion The Conquerors, as well as new campaigns, civilizations, and updated graphics for high-resolution displays. Age of Empires II: Definitive Edition, a remaster, was released in November 2019.",,327
512710,,Call of Duty: Warzone,,"Prepare to go dark, Modern Warfare is back! 
 
The stakes have never been higher as players take on the role of lethal Tier One operators in a heart-racing saga that will affect the global balance of power. Call of Duty: Modern Warfare engulfs fans in an incredibly raw, gritty, provocative narrative that brings unrivaled intensity and shines a light on the changing nature of modern war. 
 
Players will be thrust into an immersive narrative spanning the entire game. Experience the ultimate online playground with classic multiplayer or squad-up and play cooperatively in a collection of elite operations, accessible to all skill levels.",,119177
508455,fr,Valheim,,"Un jeu multijoueur brutal d'exploration et de survie pour 1 à 10 joueurs, prenant place dans un purgatoire en génération procédurale inspiré par la culture viking. Combattez, bâtissez et accomplissez des exploits à la gloire d'Odin!",steam,104967
512930,,Outriders,,"Outriders is a 1-3 player co-op RPG shooter set in an original, dark and desperate sci-fi universe. As mankind bleeds out in the trenches of Enoch, you’ll create your own Outrider and embark on a journey across the hostile planet. With rich storytelling spanning a diverse world, you’ll leave behind the slums and shanty towns of the First City and traverse forests, mountains and desert in the pursuit of a mysterious signal. Combining intense gunplay with violent powers and an arsenal of increasingly twisted weaponry and gear-sets, OUTRIDERS offers countless hours of gameplay.",,102058
31192,,Who Wants to Be a Millionaire,,"The game is based on the hit TV quiz show Who Wants to be a Millionaire? PC and Console games players can now experience for themselves the excitement and tension of the TV show as they try and win one million virtual pounds. The UK version of the game features audio clips of the TV show's host Chris Tarrant, who will be asking the questions, giving the answers, and of course, uttering the famous line, ""Is that your final answer?""; other localized versions have different hosts/voices, in addition to using questions suitable for each country.",,243
110758,,The Legend of Zelda: Breath of the Wild,,"In this 3D open-world entry in the Zelda series, Link is awakened from a deep slumber without his past memories in the post-apocalyptic Kingdom of Hyrule, and sets off on a journey to defeat the ancient evil Calamity Ganon. Link treks, climbs and glides through fields, forests and mountain ranges while meeting and helping friendly folk and defeating enemies in order to gather up the strength to face Ganon.",,7346
66364,fr,F1 Race Stars,,F1 RACE STARS™ est un tout nouveau monde de FORMULA ONE™. Un amusement sans précédent.,steam,5311
490744,fr,Stardew Valley,,"You've inherited your grandfather's old farm plot in Stardew Valley. Armed with hand-me-down tools and a few coins, you set out to begin your new life. Can you learn to live off the land and turn these overgrown fields into a thriving home?",steam,17000
941530474,,Mario Kart 8 Deluxe,,"""Hit the road with the definitive version of Mario Kart 8 and play anytime, anywhere! Race your friends or battle them in a revised battle mode on new and returning battle courses. Play locally in up to 4-player multiplayer in 1080p while playing in TV Mode. Every track from the Wii U version, including DLC, makes a glorious return. Plus, the Inklings appear as all-new guest characters, along with returning favorites, such as King Boo, Dry Bones, and Bowser Jr.! """,,2350
743,,Chess,,A straight forward chess game for the original PlayStation.,,9165
500188,fr,Hunt: Showdown,,"Hunt: Showdown est un palpitant jeu de tir à la première personne, en JcJcE. Terrassez des monstres cauchemardesques et disputez-vous des primes qui vous apporteront gloire, équipement et de l'or dans cette implacable – et inoubliable – expérience multijoueur en ligne.",steam,7291
518023,,NBA 2K21,,"NBA 2K21 is the latest title in the world-renowned, best-selling NBA 2K series, delivering an industry-leading sports video game experience. With extensive improvements upon its best-in-class graphics and gameplay, competitive and community online features, and deep, varied game modes, NBA 2K21 offers one-of-a-kind immersion into all facets of NBA basketball and culture - where Everything is Game.",,134599
752874500,,What The Dub?!,,"What The Dub?! is a multiplayer party game where each player overdubs missing dialogue from hilariously awful B-movies, outdated PSAs, and bizarre industrial films, with their own witty (or just plain stupid) dubs! 
 
Players watch the dubs and vote on the best one. The player with the highest score at the end of the game wins! It's just that easy! 
 
What The Dub takes “bad movie night” and expands it into an interactive, fast-paced, multiplayer game that friends and family, both local and afar, can enjoy! 
 
Features 
- You write the dub, we do the talking (dubs are played back via text-to-speech). 
- Play head to head with 3 to 12 players, using your phone, tablet, or computer. 
- Over 300 so-bad-they're-good clips to dub!",,144808
29307,fr,Path of Exile,,"You are an Exile, struggling to survive on the dark continent of Wraeclast, as you fight to earn power that will allow you to exact your revenge against those who wronged you. Created by hardcore gamers, Path of Exile is an online Action RPG set in a dark fantasy world.",steam,1911
491318,fr,Borderlands 3,,"The original shooter-looter returns, packing bazillions of guns and a mayhem-fueled adventure! Blast through new worlds and enemies as one of four new Vault Hunters.",steam,19164
502732,,Garena Free Fire,,"Free Fire - Battlegrounds is the ultimate survival shooter game available on mobile. Each 10-minute game places you on a remote island where you are pit against 50 other players, all seeking survival. Players freely choose their starting point with their parachute, and aim to stay in the safe zone for as long as possible. Drive vehicles to explore the vast map, hide in trenches, or become invisible by proning under grass. Ambush, snipe, survive, there is only one goal: to survive.",,87622
514858,,League of Legends: Wild Rift,,"Welcome to the Wild Rift! Featuring the same skill-based 5v5 PVP gameplay you expect from League of Legends on PC, Wild Rift was built from the ground up for new platforms. Lock your choice from a huge cast of League champions, team up with friends, and outplay the opposition.",,124700
510218,fr,Among Us,,An online and local party game of teamwork and betrayal for 4-10 players...in space!,steam,111469
461067,fr,Tekken 7,,"Découvrez la conclusion épique de la guerre de longue haleine entre les membres de la famille Mishima. Animée par le moteur Unreal Engine 4, la légendaire franchise de jeux de baston revient avec d'époustouflants combats cinématiques scénarisés et d'intenses duels à jouer avec vos amis ou rivaux.",steam,7498
516575,,VALORANT,,"Imagine this: tactical shooter meets hypernatural powers. Everyone’s got guns and a unique set of abilities, so how do you beat someone with the speed of wind? Use your own moves to outplay them and beat them to the shot. VALORANT is a game for bold strategists who dare to make the unexpected play, because if it wins, it works.",,126459
518204,,FIFA 21,,"Win as One in EA SPORTSFIFA 21, powered by Frostbite. Whether it's on the streets or in the stadium, FIFA 21 has more ways to play than ever before - including the UEFA Champions League and CONMEBOL Libertadores.",,134101
460630,fr,Tom Clancy's Rainbow Six Siege,,Tom Clancy's Rainbow Six Siege marque le retour de la célèbre franchise de FPS dans un tout nouvel opus développé par le studio d’Ubisoft Montréal.,steam,7360
32982,fr,Grand Theft Auto V,,Grand Theft Auto V sur PC offre aux joueurs la possibilité d'explorer le monde de Los Santos et Blaine County en haute résolution (jusqu'à 4K) et à 60 images par seconde.,steam,1020
24241,fr,FINAL FANTASY XIV Online,,Prenez place dans un FINAL FANTASY XIV épique et en constante évolution et partez à l'aventure pour l'explorer avec des amis du monde entier.,steam,386
490422,,StarCraft II,,"In the distant future, in the darkest reaches of space, the ghosts of the past whisper your name. You are Jim Raynor, a marshal-turned-rebel on a vigilante crusade to bring down the Dominion and its nefarious leader, Arcturus Mengsk. Haunted by betrayal and remorse, some believe you may have given up the fight. But you have promises to keep… and a need for vengeance that’s long overdue.",,239
506344,fr,Totally Accurate Battlegrounds,,"Grab your balloon crossbow and trusty inflatable hammer, because things are about to get wobbly! Be the last weirdo standing in the world-leading physics-based Battle Royale game.",steam,103222
493057,fr,PLAYERUNKNOWN'S BATTLEGROUNDS,,PLAYERUNKNOWN'S BATTLEGROUNDS is a battle royale shooter that pits 100 players against each other in a struggle for survival. Gather supplies and outwit your opponents to become the last person standing.,steam,27789
1267741587,,Clash Quest,,,,145533
18122,,World of Warcraft,,"World of Warcraft is a massively multiplayer online roleplaying game (MMORPG) set in the Warcraft universe. Players assume the roles of Warcraft heroes as they explore, adventure, and quest across a vast world. Being ""Massively Multiplayer,"" World of Warcraft allows thousands of players to interact within the same world. Whether adventuring together or fighting against each other in epic battles, players will form friendships, forge alliances, and compete with enemies for power and glory.",,123
509538,,Animal Crossing: New Horizons,,"Escape to a deserted island and create your own paradise as you explore, create, and customize in the Animal Crossing: New Horizons game. Your island getaway has a wealth of natural resources that can be used to craft everything from tools to creature comforts. You can hunt down insects at the crack of dawn, decorate your paradise throughout the day, or enjoy sunset on the beach while fishing in the ocean. The time of day and season match real life, so each day on your island is a chance to check in and find new surprises all year round.",,109462
497057,fr,Destiny 2,,"Destiny 2 is an action MMO with a single evolving world that you and your friends can join anytime, anywhere, absolutely free.",steam,25657
386821,fr,Black Desert Online,,"Black Desert Online est un MMORPG dans un monde vivant en constante évolution. Découvrez des combats rapides et dynamiques, chassez des monstres, terrassez des boss gigantesques, battez-vous aux côtés de vos partenaires de guilde lors de guerres, apprenez de nombreux métiers...",steam,6292
504461,,Super Smash Bros. Ultimate,,"Legendary game worlds and fighters collide in the ultimate showdown—a new entry in the Super Smash Bros. series for the Nintendo Switch system! New fighters, like Inkling from the Splatoon series and Ridley from the Metroid series, make their Super Smash Bros. series debut alongside every Super Smash Bros. fighter in the series…EVER! Faster combat, new items, new attacks, new defensive options, and more will keep the battle raging whether you’re at home or on the go.",,90101
313558,,Diablo III,,"The game takes place in Sanctuary, the dark fantasy world of the Diablo series, twenty years after the events of Diablo II. Deckard Cain and his niece Leah are in the Tristram Cathedral investigating ancient texts regarding an ominous prophecy. Suddenly, a mysterious star falling from the sky strikes the Cathedral, creating a deep crater into which Deckard Cain disappears.",,120
33180,,The Last of Us,,"A third person shooter/stealth/survival hybrid, in which twenty years after the outbreak of a parasitic fungus which takes over the neural functions of humans, Joel, a Texan with a tragic familial past, finds himself responsible with smuggling a fourteen year old girl named Ellie to a militia group called the Fireflies, while avoiding strict and deadly authorities, infected fungal hosts and other violent survivors.",,1009
491931,,Escape From Tarkov,,Escape from Tarkov is a hardcore and realistic online first-person action RPG/Simulator with MMO features and story-driven walkthrough.,,15536
1614555304,,Call Of Duty: Modern Warfare,,"Welcome to Warzone, the new massive free-to-play combat arena from the world of Modern Warfare®. Drop in, armor up, loot for rewards, and battle your way to the top.",,119177
518213,,It Takes Two,,"Bring your favorite co-op partner and together step into the shoes of May and Cody. As the couple is going through a divorce, through unknown means their minds are transported into two dolls which their daughter, Rose, made to represent them. Now they must reluctantly find a way to get back into their bodies, a quest which takes them through the most wild, unexpected and fantastical journey imaginable.",,135243
518011,,HITMAN 3,,"Agent 47 returns as a ruthless professional for the most important contracts of his entire career in HITMAN 3, the dramatic conclusion to the World of Assassination trilogy.",,134595
2692,,Super Mario 64,,"The first three dimensional entry in the Mario franchise, Super Mario 64 follows Mario as he puts his broadened 3D movement arsenal to use in order to rescue Princess Peach from the clutches of his arch rival Bowser. Mario has to jump into worlds-within-paintings ornamenting the walls of Peach's castle, uncover secrets and hidden challenges and collect golden stars as reward for platforming trials.",,1074
518184,fr,Phasmophobia,,Phasmophobia is a 4 player online co-op psychological horror. Paranormal activity is on the rise and it’s up to you and your team to use all the ghost hunting equipment at your disposal in order to gather as much evidence as you can.,steam,132516
491080,fr,The Binding of Isaac: Afterbirth,,"The Binding of Isaac: Rebirth is a randomly generated action RPG shooter with heavy Rogue-like elements. Following Isaac on his journey players will find bizarre treasures that change Isaac’s form giving him super human abilities and enabling him to fight off droves of mysterious creatures, discover secrets and fight his way to safety.",steam,7789
75467,fr,Euro Truck Simulator 2,,"Travel across Europe as king of the road, a trucker who delivers important cargo across impressive distances! With dozens of cities to explore, your endurance, skill and speed will all be pushed to their limits.",steam,3070
29595,fr,Dota 2,,"Every day, millions of players worldwide enter battle as one of over a hundred Dota heroes. And no matter if it's their 10th hour of play or 1,000th, there's always something new to discover. With regular updates that ensure a constant evolution of gameplay, features, and heroes, Dota 2 has taken on a life of its own.",steam,2963
65632,fr,DayZ,,"Survivrez-vous longtemps dans ce monde post-apocalyptique ? Un monde envahi de &quot;zombies&quot;, où il faudra partager de maigres ressources avec les autres survivants. Vous allierez-vous à des inconnus pour faire front ? Survivrez-vous en solo pour éviter les trahisons ? DayZ, c'est votre histoire.",steam,2117
499003,fr,VRChat,,"Join our growing community as you explore, play, and help craft the future of social VR. Create worlds and custom avatars. Welcome to VRChat.",steam,33615
