TwitchCategoryId,Language,Name,Synopsis,Summary,Source,IGDBId,SteamId
32178,,Octodad: Dadliest Catch,,"Octodad: Dadliest Catch is a game about destruction, deception, and fatherhood. The player controls Octodad, a dapper octopus masquerading as a human, as he goes about his life. Octodad's existence is a constant struggle, as he must master mundane tasks with his unwieldy boneless tentacles while simultaneously keeping his cephalopodan nature a secret from his human family.",,4788,224480
32178,ru,Octodad: Dadliest Catch,,"Octodad: Dadliest Catch — это игра о разрушении, хитрости и отцовстве. Игроку предстоит управлять Осьмипапой, проворным осьминогом, притворяющимся человеком. Жизнь Осьмипапы проходит в постоянной борьбе, в которой ему приходится справляться с повседневными задачами при помощи своих бескостных щупалец, держа при этом свою осминожью...",steam,4788,224480
513455,ru,Hired Ops,,"Hired Ops — сессионный онлайн-шутер, посвященный боевым операциям, в котором игроку придется пойти на все ради господства на мировом рынке наемников.",steam,35145,374280
13248,ru,Sonic the Hedgehog CD,,"Время отправиться из прошлого в будущее в этом дополненном переиздании Sonic CD! Соник путешествует к дальним берегам озера Never Lake ради того, чтобы увидеть ежегодное появление Маленькой Планеты - загадочного мира, где прошлое, настоящее и будущее сталкиваются друг с другом силой спрятанных на ней Камней Времени.",steam,5452,200940
516612,ru,Dandy Ace,,"Dandy Ace — это захватывающая игра в жанре экшен, главный герой которой — невероятный фокусник — сражается и собирает добычу, комбинируя и используя волшебные карты. Ему предстоит победить Зеленоглазого Иллюзиониста и снять проклятие заколдованного зеркала.",steam,116533,1037130
493724,ru,Senran Kagura: Peach Beach Splash,,"The buxom shinobi of SENRAN KAGURA are back, and they've traded their katanas for water guns in this Third-Person Splasher! Customize your team, lead them through battles across a sprawling single-player campaign, or go online and take on teams worldwide. Come on in; the water's great!",steam,25656,696170
490438,ru,Ultimate Chicken Horse,,"Вы когда-нибудь хотели стать лошадью, причём не обычной, а скачущей по стенам, ставящей ловушки и мастерски уворачивающейся от стрел, и в этой ипостаси попробовать обогнать своих зверей-приятелей в полной опасностей и преград гонке по вместе построенной вами же трассе?",steam,18158,386940
516061,ru,Secret Government,,"Игра в жанре пошаговой стратегии о тайном обществе, которое сотни лет незримо правит человечеством. И в этом её особенность: вы возглавите не какую-то страну, как это обычно бывает, а организацию, которая влияет на весь мир. Братство.",steam,110178,946990
509065,,Secret Neighbor,,"Secret Neighbor is a Multiplayer Social Horror game set in the Hello Neighbor universe. 
 
A group of kids tries to sneak into their creepy Neighbor's basement to rescue their missing friend. The only problem is one of the players is a traitor in disguise. 
 
Yes, you can play as the Neighbor.",,103295,859570
509065,ru,Secret Neighbor,,"Secret Neighbor - захватывающий многопользовательский хоррор, в котором группа детей пытается спасти своего друга из жуткого подвала Соседа. Единственная проблема в том, что один из детей - это замаскированный сосед.",steam,103295,859570
512940,ru,Yooka-Laylee and the Impossible Lair,,"Yooka-Laylee and the Impossible Lair — это совершенно новый приключенческий платформер от талантливых творцов, стоявших за разработкой Donkey Kong Country. С парочкой ярких приятелей вы пройдете серию захватывающих уровней в формате 2,5D и встретитесь с загадками и сюрпризами трехмерного мира!",steam,119259,846870
517128,ru,Cepheus Protocol,,"An unimaginable plague has been released in San Francisco, turning the population into mutated creatures hellbent on spreading the Pangu Virus. Inspired by classic RTS series Company of Heroes and World in Conflict, it is up to you to win back the city before the Pangu Virus spreads globally.",steam,127246,979640
12206,ru,ToeJam & Earl,,"ToeJam &amp; Earl™ are both highly funky aliens from the planet Funkotron. Recently they ran into a slight problem... They were cruising in their highly funky, ultra cool, righteous rapmaster rocketship when Earl said he’d like a shot at driving.",steam,8389,71166
490919,ru,Far Cry: Primal,,"Знаменитая серия Far Cry перенесет вас на просторы открытого мира, населенного удивительной фауной. Здесь с вами может произойти что угодно. Будьте готовы к неожиданностям! Вы окажетесь в каменном веке, а значит - в смертельной опасности.",steam,13182,371660
515072,ru,Curse of the Dead Gods,,"Вы ищете несметные богатства, вечную жизнь и могущество. Ваши поиски привели вас в этот проклятый храм, в бесконечный лабиринт, где вас ждут бездонные пропасти, ловушки и монстры.",steam,125373,1123770
29635,ru,Far Cry 3,,Discover the dark secrets of a lawless island ruled by violence and take the fight to the enemy as you try to escape. You’ll need more than luck to escape alive!,steam,529,220240
516783,ru,Pro Cycling Manager 2020,,"Станьте менеджером команды велосипедистов и приведите их к победе! Вам придется заниматься финансами, подбором спортсменов, планировать тренировки, разрабатывать стратегию гонок, а в этой версии — еще и приглядывать за велосипедистами и их моральным состоянием.",steam,132335,1178400
490414,ru,Quiplash,,"For 3-8 Players and an Audience of thousands! Your phones or tablets are your controllers! The gut-busting, say-anything, no-rules party game!",steam,11588,351510
498796,ru,Rise of Insanity,,"В Rise of Insanity Ты, как доктор психологии, обнаружишь самые темные углы человеческого разума. Преодолей свой страх и узнай, что на самом деле произошло в Твоей семьи. До чего доведет Тебя безумие?",steam,34665,629220
490393,ru,Motorsport Manager,,"Станьте менеджером высокоэффективной команды автогонщиков. Motorsport Manager - это лучший в своем классе спортивный менеджер для любителей автогонок. Управление командой, создание автомобилей и полное погружение в увлекательный спортивный мир. В борьбе за чемпионский титул нет второстепенных деталей.",steam,19293,415200
461492,ru,Keep Talking and Nobody Explodes,,"Окажитесь взаперти один на один с тикающей бомбой. У ваших друзей есть руководство к обезвреживанию, но они не видят бомбу, поэтому объяснять придется на словах и как можно быстрее! Для этой совместной локальной игры необходимо два и более игроков.",steam,13226,341800
515851,,The Witch's House MV,,"A young girl, Viola, is drawn inexorably to a mysterious manor that seems to change behind her back. It is a place of pain, turmoil and death. Plumb its detestable depths and abominable history. Untangle riddles that bar your perilous path. And flee the hellish halls of The Witch’s House.",,46999,
370345,ru,SpeedRunners,,"Заводная мультиплеерная игра-платформер, в которой 4 игрока соревнуются между собой локально/в мультиплеере. Бегите, прыгайте, уворачивайтесь от других игроков и используйте арсенал оружия, чтобы выкинуть соперников за экран!",steam,9527,207140
19009,ru,Dead Space,,"You are Isaac Clarke, an engineer on the spacecraft USG Ishimura. You're not a warrior. You're not a soldier. You are, however, the last line of defense for the remaining living crew.",steam,37,17470
512623,ru,Cricket 19,,"Lead your team to international glory with Cricket 19. The truly global cricket simulation from Big Ant Studios, the leading name in authentic, realistic cricket action, Cricket 19 allows you to take control of your team, from club through national level, and lead them to T20, ODI, or Test Match glory.",steam,115869,1028630
510389,,Shakes and Fidget,,Shakes and Fidget is a fun fantasy RPG satire and an award-winning role-playing game at the same time! Sounds crazy? Over 50 million players make it one of the most popular online games in the world! Customize your own comic book hero and conquer the top slot of the Hall of Fame!,,18090,438040
510389,ru,Shakes and Fidget,,"Shakes и Fidget - это веселая и юморная пародия на фэнтезийные RPG, удостоенная наград как одна из лучших ролевых игр! Звучит странно? Однако в SFGAME более 50 миллионов игроков, и это одна из самых популярных онлайн-игр в мире!",steam,18090,438040
517453,ru,Arboria,,"Отправляйтесь в путешествие по мрачному фантастическому миру в стиле rogue-lite. Спуститесь в изменчивый подземный Дурнар и раскройте все тайны племени воина-Йотуна. Разите врагов симбиотическим оружием и мутируйте, чтобы становиться сильнее.",steam,126432,924070
489671,ru,Cossacks 3,,"&quot;Казаки 3&quot; - классическая RTS с редким сочетанием войны, экономики, строительства и технологического развития, которое нельзя встретить ни в одной игре за последние 15 лет. Продолжение культовой игровой серии позволит снова окунуться в золотой век жанра стратегий.",steam,13215,333420
498325,ru,The First Tree,,"Это красивый квест от третьего лица о , в котором переплелись две истории: лисы, пытающейся отыскать свою семью и мальчика, решившего найти отца.",steam,20909,555150
494363,ru,TaleSpire,,"TaleSpire is a beautiful way to play pen and paper RPGs online. Bring your stories to life and embark upon campaigns together with your friends, regardless of where you are in the world.",steam,57260,720620
514661,ru,The Long Drive,,Random generated open world semi-post apocalyptic survival car driving game.,steam,122589,1017180
511995,ru,Snooker 19,,Snooker 19 – официальная игра World Snooker.,steam,111153,887800
512566,,Rolled Out!,,"Get ready to tilt and bounce your way through Rolled Out!, a marble-rolling game with charming characters and precise controls. All you need is one joystick to roll to the goal; with over 150 hand-crafted stages to tackle, there's always a new challenge around the corner!",,123117,
514930,ru,Song of Horror,,"Song of Horror — это приключенческая история о выживании, действие в которой происходит от третьего лица. Ваш самый страшный враг — Присутствие, таинственное существо, с которым невозможно бороться. Вам остается лишь прятаться, быть предельно осторожными и дышать как можно тише...",steam,121555,1096570
15631,ru,Grand Theft Auto: Vice City,,"Welcome to Vice City. Welcome to the 1980s. From the decade of big hair, excess and pastel suits comes a story of one man's rise to the top of the criminal pile.",steam,733,12110
516458,ru,When The Past Was Around,,"When the Past was Around, это приключенческая игра о любви, и о том, что важно двигаться дальше и отпускать, а также всей радости и печали, что сопровождает нас во время этого.",steam,119324,1164050
491491,ru,Attack on Titan,,"Международный аниме-хит «Attack on Titan» появился и на Steam®! Людоеды Titans и Eren со спутниками вступают в бой. Почувствуйте себя героем аниме и управляйте развитием сюжета. Вас ждет сюжет из аниме, но с несколькими оригинальными поворотами!",steam,14879,449800
509249,ru,The Dark Pictures Anthology: Man of Medan,,"Антология The Dark Pictures — цикл нелинейных киноигр в жанре хоррор с поддержкой игры вдвоём по сети. В Man of Medan пятеро друзей отправились на дайвинг, но шторм превратил их поездку в настоящий кошмар.",steam,55047,939850
514425,,Later Alligator,,"Pat the alligator, a (mostly) harmless and (probably) innocent reptile is at the center of a conspiracy that could bring down the biggest, scariest family in Alligator New York City: his own! Explore the city, meet the Family, and try to save Pat before the clock runs out.",,112939,966320
514425,ru,Later Alligator,,"Pat the alligator, a (mostly) harmless and (probably) innocent reptile is at the center of a conspiracy that could bring down the biggest, scariest family in Alligator New York City: his own! Explore the city, meet the Family, and try to save Pat before the clock runs out.",steam,112939,966320
517507,ru,The Dungeon Of Naheulbeuk: The Amulet Of Chaos,,"Step into the wacky heroic fantasy universe of the Dungeon of Naheulbeuk. Lead a team of unlikely and clumsy heroes in an epic and challenging tactical RPG. Live an adventure filled with humor, surprises and silly encounters.",steam,120654,970830
492070,ru,Crush Your Enemies,,"Вернитесь в те далекие дни, когда выходили потрясающие стратегии в реальном времени. Crush Your Enemies - это все, что вы любите в стратегиях: планирование, широкий выбор юнитов различных типов, управление ресурсами, захват вражеской территории и возможность перехитрить противника необычным построением отрядов.",steam,17027,406850
518081,ru,Cartel Tycoon,,"Сюжетный бизнес-симулятор Cartel Tycoon вдохновлен историей наркоторговли в 80-х годах. Расширяйте свою сеть и поглощайте другие, не привлекая внимания конкурентов и властей. Заслужите преданность сотрудников и постарайтесь, чтобы вас не постигла печальная судьба слишком могущественных наркобаронов.",steam,128991,1220140
8694,ru,Half-Life 2: Episode Two,,"1998 год. HALF-LIFE шокирует игровую индустрию сочетанием напряженного действия и непрерывного, затягивающего сюжета. Дебютная игра Valve завоевала свыше 50 наград «Игра года» на пути к получению титула «Лучшая игра для РС всех времен» от PC Gamer; она раскрутила франшизу, которая продала свыше восьми миллионов коробочных версий по всему...",steam,233,220
67562,,Freedom Planet,,"Freedom Planet is a combat-based platform adventure that pits a spunky dragon girl and her friends against an alien attack force. There's trouble around every turn, from insects to giant robots to sheer explosive destruction, but you'll have a variety of special fighting abilities to blast your way through each stage. 

As Lilac, you can use Dragon powers to whip enemies with your hair, spin like a cyclone, or fly through the air at high speed like a comet. 
As Carol, you can bust through foes with a flurry of punches and kicks or summon motorcycles that let you ride up walls and ceilings.",,7116,248310
67562,ru,Freedom Planet,,"Fight your way across the celestial world of Avalice where cats are green, motorcycles drive up walls and monster girls do most of the buttkicking! Freedom Planet is a cartoony, combat-based platform adventure that pits a spunky dragonoid and her friends against an alien attack force.",steam,7116,248310
488831,ru,Naval Action,,"Naval Action is a hardcore, realistic, and beautifully detailed naval combat sandbox immersing players into the experience of the most beautiful period of naval history - when sailing ships ruled the seas.",steam,16969,311310
488820,ru,Stranded Deep,,Take the role of a plane crash survivor stranded somewhere in the Pacific Ocean. Come face to face with some of the most life threatening scenarios that will result in a different experience each time you play. Scavenge. Discover. Survive.,steam,8751,313120
515230,ru,BatMUD,,BatMUD is a text-based medieval fantasy massively multiplayer online game with an extremely rich set of features - constantly in development since 1990.,steam,126128,616920
1366210635,ru,Ranch Simulator,,"Строительство. Фермерство. Охота. Торговля. Быть владельцем ранчо — явно не самая простая работа. Думаете, вам по силам сделать захудалое семейное ранчо самым процветающим в округе? Тогда вперед, в провинцию — вас ждет симулятор в открытом мире с возможностью одиночной и многопользовательской игры!",steam,121087,1119730
497916,ru,The Walking Dead: The Final Season,,"Клементина наконец-то может обрести свой дом, но ей придется многим пожертвовать, чтобы защитить его.",steam,51524,866800
15483,,Donkey Kong Country 2: Diddy's Kong Quest,,Donkey Kong Country 2: Diddy's Kong Quest is the sequel to Donkey Kong Country. It was developed by Rare and is one of the best selling Super Nintendo games.,,1092,
493277,ru,Battlerite,,"BATTLERITE — это игра жанра TAB (Team Arena Brawler), смесь шутера с видом сверху и файтинга. Вместе с друзьями брось вызов врагам, и пусть победит тот, чья реакция быстрее. Арена ждёт!",steam,23193,504370
509073,ru,Cube Escape: Paradox,,"Paradox – это кроссовер игры Cube Escape и короткометражки Rusty Lake! Сыграйте за детектива, который должен выбраться из зловещей комнаты в параллельных вселенных.",steam,100667,909080
14605,,Richard Burns Rally,,"Richard Burns Rally (RBR) is a sim racing game, published by SCi and developed by Warthog with advice of WRC champion Richard Burns. 
 
It was released in July 2004 for PlayStation 2, Xbox, Microsoft Windows, and in October 2005 for Gizmondo",,6004,
496697,ru,Code Vein,,"Создайте своего бессмертного, найдите союзников и преодолейте испытания, чтобы вспомнить прошлое и вырваться из ада в игре CODE VEIN.",steam,28168,678960
638347790,ru,Red Lake,,"Red Lake - приключенческий хоррор с элементами шутера. Главный герой работает в агенстве, которое занимается поиском паранормальных мест с целью исследования и ограждения их от людей.",steam,35589,357290
1524,ru,Sonic the Hedgehog 2,,"Доктор Эггман (он же доктор Роботник) вернулся, чтобы превратить беспомощных животных в роботов и заставить их строить свое новое абсолютное оружие, Смертельной Яйцо! Но на этот раз у Соника есть друг, который поможет ему — Тейлз! Найдите 7 Изумрудов хаоса и остановите злые замыслы доктора Роботника!",steam,4438,71163
15512,ru,Star Wars: Jedi Knight - Jedi Academy,,Forge your weapon and follow the path of the Jedi Jedi Knight: Jedi Academy is the latest installment of the highly acclaimed Jedi Knight series. Take on the role of a new student eager to learn the ways of the Force from Jedi Master Luke Skywalker.,steam,153,6020
499790,ru,KARDS: The WWII Card Game,,"KARDS, карточная игра в сеттинге Второй мировой войны, сочетает в себе традиционный игровой процесс ККИ с инновационными механиками, вдохновлёнными классическими стратегиями и реальной тактикой боя.",steam,75140,544810
513314,ru,Voxel Tycoon,,"Voxel Tycoon — a management sim set in the infinite voxel world. Mine resources and process them into goods on your custom factories. Set up supply chains and passenger routes with a huge fleet of trains, trucks, and buses, and turn small cities into prosperous megapolises with a thriving economy!",steam,83973,732050
2755,ru,Half-Life,,"Боевик, приключения и удостоенная наград технология создания потрясающе реалистичного мира, в котором игрок должен думать, чтобы выживать — всё это обладатель звания «Игра года» от более чем 50 изданий, дебютная игра от Valve — Half-Life.",steam,231,70
495563,ru,Project CARS 2,,"ПУТЕШЕСТВИЕ В МИР АВТОСПОРТА В Project CARS 2 вас ждут захватывающие впечатления, прекрасные автомобили и невероятные трассы, а еще реалистичное управление, динамическая погода и множество режимов.",steam,26709,378860
516621,ru,THE LONGING,,Необычная смесь приключения и неторопливого хождения. Ваша задача — ждать пробуждения короля в полном одиночестве глубоко под землей... в течение 400 дней.,steam,107927,893850
