TwitchCategoryId,Language,Name,Synopsis,Summary,Source,IGDBId,SteamId
13248,,Sonic the Hedgehog CD,,"Sonic travels to the distant shores of Never Lake for the once-a-year appearance of Little Planet - a mysterious world where past, present, and future collide through the power of the Time Stones that lie hidden within it. 
 
Sonic arrives only to find the once beautiful world imprisoned beneath a twisted metallic shell. His arch-nemesis, Dr. Eggman, has come for the Time Stones and with them, will soon have the power to control time itself! 
 
In order to put an end to Dr. Eggman’s nefarious schemes, Sonic must use the power of Little Planet to travel through time; breaking Dr. Eggman’s hold over the future by destroying his machines in the past and recovering the missing Time Stones!",,5452,200940
13248,fr,Sonic the Hedgehog CD,,"L'heure de célébrer le passé dans le futur est arrivée grâce à cette réédition améliorée de Sonic CD ! Sonic voyage jusqu'aux lointains rivages de Never Lake pour voir l'apparition annuelle de Little Planet, un monde mystérieux dont le passé, le présent et l'avenir se croisent grâce à la puissance des Time Stones cachées en son sein.",steam,5452,200940
9096,,Waterworld,,"The sun. For millions of years the source of life. But for one planet the source of it's demise. The temperature climbed, the vast pools of ice at it's poles melted, and the oceans rose. Centuries later, few people remained on this planet, once called Earth. A lone mariner sails the expanse of water, trading to survive. For survival, is all these people do, in this place they know only as Waterworld.",,20987,
519224,,Sorare,,,,138715,
505717,,Youtubers Clicker,,"Youtubers clicker - is a game where you goal is 
to create your own partner company, combine all the tubers 
and earn the maximum number of subscribers. 
Ready? Good luck!",,54332,689750
512940,,Yooka-Laylee and the Impossible Lair,,"Yooka and Laylee are back for a brand new adventure! Get ready for the ultimate challenge - the Impossible Lair! 
 
Capital B has created a Hivemind device and used it to enslave the toughest bees in the Royal Stingdom - the Royal Beettalion Guard! 
 
Liberate them from chapters filled with only the tastiest 2D platforming trimmings, and take on a 3D overworld that contains a wealth of puzzles, secrets and some familiar faces!",,119259,846870
512940,fr,Yooka-Laylee and the Impossible Lair,,"Yooka-Laylee et le repaire impossible est un tout nouveau jeu d'aventure et de plateforme conçu par les talents derrière « Donkey Kong Country ». Sous la forme d'un duo d'amis haut en couleur, vous devez triompher dans une série de niveaux en 2,5D à couper le souffle et explorer un mystérieux Overworld en 3D riche en secrets et en...",steam,119259,846870
1116745944,,Baldur's Gate II: Enhanced Edition,,"Kidnapped. Imprisoned. Tortured. The wizard Irenicus holds you captive in his stronghold, attempting to strip you of the powers that are your birthright. 
 
Can you resist the evil within you, forge a legend of heroic proportions, and ultimately destroy the dark essence that haunts your dreams? Or will you embrace your monstrous nature, carve a swath of destruction across the realms, and ascend to godhood as the new Lord of Murder? 
 
Baldur's Gate II: Enhanced Edition brings this critically acclaimed role-playing experience to PC, Mac, iPad, and Android.",,6,
517128,,Cepheus Protocol,,"Find patient zero before an alien virus takes over San Francisco and the cepheus protocol is enacted. Command your squad, save civilians, and stop the Pangu virus. Kill patient zero and save the world.",,127246,979640
517128,fr,Cepheus Protocol,,"An unimaginable plague has been released in San Francisco, turning the population into mutated creatures hellbent on spreading the Pangu Virus. Inspired by classic RTS series Company of Heroes and World in Conflict, it is up to you to win back the city before the Pangu Virus spreads globally.",steam,127246,979640
491878,,BeamNG.drive,,"BeamNG.drive is a realistic, immersive driving game offering near-limitless possibilities. Our soft-body physics engine simulates every component of a vehicle in real time, resulting in realistic, dynamic behavior.      
The driving feel is authentic and visceral, and crashes are realistic and violent; yet the physics are accessible enough to drive with a keyboard or gamepad while still being authentic with a full racing wheel with uncompromising realism.",,17131,284160
491878,fr,BeamNG.drive,,Un simulateur de véhicules basé sur la dynamique des corps mous et capable de faire à peu près n'importe quoi.,steam,17131,284160
18526,,The Elder Scrolls IV: Oblivion,,"After the mysterious and untimely death of the Emperor, desperate factions vie for control of Tamriel's throne. With the empire ready to crumble, the gates of Oblivion open and demons march upon the land, laying waste to everything in their path. To turn the tide of darkness the player must find the lost heir to the throne and unravel the sinister plot that threatens to destroy all of Tamriel.",,59,22330
18526,fr,The Elder Scrolls IV: Oblivion,,L'édition de l'année d'Elder Scrolls IV: Oblivion® vous apporte un des meilleurs jeux de rôle jamais conçu. Entrez dans un monde vibrant et exceptionnel. Suivez la quête principale ou prenez la liberté d'explorer ce monde comme vous le souhaitez.,steam,59,22330
1893867416,,Blackjack,,Either 1 or 2 players can join in this American casino game based on Las Vegas rules which include taking insurance on a bet and doubling your bet. Database Games-Computer keeps track of the money you win or lose in its computer memory bank.,,27230,
12206,,ToeJam & Earl,,"ToeJam & Earl is an early 1990s dungeon crawler for the Sega Genesis/MegaDrive. The game features two alien rappers, who have crash-landed on Earth and parodies 1980s urban culture. The game’s design was heavily influenced by the role-playing video game Rogue, and took from it such features as the random generation of levels and items. Played from a 2D-top-down perspective the game contains both single-player and two-player cooperative modes. The latter displays a single screen when both characters are near each other, but splits it apart when they are not. Playing the game with two players reveals dialogue and jokes between the characters not heard in the single player game.",,8389,71166
12206,fr,ToeJam & Earl,,"ToeJam &amp; Earl™ sont deux extraterrestres funky, venus de la planète Funkotron. Ils se sont récemment heurtés à un problème... Ils se baladaient dans leur fusée super cool de maîtres du rap lorsque Earl a dit qu’il voulait essayer de la piloter.",steam,8389,71166
514459,,Sword Art Online: Alicization Rising Steel,,"A tale of noble souls. 
 
Sword Art Online's newest RPG game, based on the Alicization arc, is coming to a smartphone near you!",,125818,
490393,fr,Motorsport Manager,,Devenez le manager d'une équipe de sports automobiles de haut niveau. Motorsport Manager est une simulation de management détaillée et de grande qualité dédiée aux fans de sports automobiles.,steam,19293,415200
517453,,Arboria,,"Begin your journey in this dark fantasy rogue-lite. As a warrior, a Yotun, descend into the ever-changing Durnar and uncover the mysteries of your tribe. Use a variety of Symbiotic Weapons to fight enemies and mutate to become even stronger.",,126432,924070
517453,fr,Arboria,,"Entamez un périple dans ce rogue-lite à l'univers de dark fantasy. Incarnez un guerrier Yotun, aventurez-vous au cœur du monde changeant de Durnar, et percez les mystères de votre tribu. Utilisez un éventail d'armes symbiotiques pour combattre vos ennemis et mutez pour devenir encore plus fort.",steam,126432,924070
492354,,Fire Emblem Heroes,,"""Take part in strategic turn-based battles streamlined for on-the-go play with maps that fit in the palm of your hand! Lead your army with easy touch and drag controls, including the ability to attack by simply swiping an ally over an enemy.""",,26841,
16893,,Harry Potter and the Goblet of Fire,,"Harry Potter and the Goblet Of Fire continues that adventures of Harry Potter. Harry is mysteriously selected as the fourth contestant in the dangerous Triwizard Tournament. Each competitor in the international competition must confront a fire-breathing dragon, rescue friends from the icy depths of the Black Lake, and navigate the twisting mysteries of a vast, dangerous maze. Players can experience the thrills of the movie from the Quidditch World Cup campsite to a heart-stopping duel with Lord Voldemort himself! Experience the thrilling moments of the movie and put your magic to the ultimate test.",,3942,
518381,,Locked Up,,,,137990,
4694,,Super Monkey Ball 2,,"The object of Super Monkey Ball 2 is to guide a monkey trapped inside a plastic ball through a maze to the goal. There are three variations, story mode, challenge mode, and practice mode. In story mode you have unlimited number of tries to complete a stage, and after clearing 10 stages a movie clip is shown followed by a new world of 10 stages. In challenge mode, you have a limited number of monkeys and a time limit to complete numerous levels of increasing difficulty. In practice mode you can play any stage already completed in the other two modes. 
 
In addition to the main game options, numerous party games are also included. These are monkey race, monkey fight, monkey target, monkey billiards, monkey bowling, monkey golf, monkey boat, monkey shot, monkey dogfight, monkey soccer, monkey baseball, and monkey tennis. The party games can be played by one to four players.",,2928,
33913,,Banja,,,,93537,
9250,,Mario Kart 64,,"Mario Kart 64 is the second main installment of the Mario Kart series. It is the first game in the series to use three-dimensional graphics, however, the characters and items in this game are still two-dimensional, pre-rendered sprites. The game offers two camera angles and three engine sizes: 50cc, 100cc and 150cc. Each kart has distinctive handling, acceleration and top speed capabilities. Shells that you fire at rival racers, Bananas that make them skid out and Lightning Bolts that make them small and very slow are just a few of the game's unique power-ups.",,2342,
752874500,,What The Dub?!,,"What The Dub?! is a multiplayer party game where each player overdubs missing dialogue from hilariously awful B-movies, outdated PSAs, and bizarre industrial films, with their own witty (or just plain stupid) dubs!

Players watch the dubs and vote on the best one. The player with the highest score at the end of the game wins! It's just that easy!

What The Dub takes “bad movie night” and expands it into an interactive, fast-paced, multiplayer game that friends and family, both local and afar, can enjoy!

Features
- You write the dub, we do the talking (dubs are played back via text-to-speech).
- Play head to head with 3 to 12 players, using your phone, tablet, or computer.
- Over 300 so-bad-they're-good clips to dub!",,144808,
514661,,The Long Drive,,Random generated open world semi-post apocalyptic survival car driving game.,,122589,1017180
514661,fr,The Long Drive,,Random generated open world semi-post apocalyptic survival car driving game.,steam,122589,1017180
17085,,Quiz Show,,A game based on an Italian quiz game show.,,79378,
16967,,The Legend of Zelda: The Wind Waker,,"An entry in the Legend of Zelda series of action-adventure games in which Link, a boy living modestly on a small island in the Great Sea, sets off on a sailing adventure after his sister is kidnapped by a giant bird, but is eventually thrust into the same position as the Hero of Time told in legend, and has to face Ganondorf, the reincarnated villain of The Legend of Zelda: Ocarina of Time (1998).",,1033,
517953,,8Doors: Arum's Afterlife Adventure,,8Doors is Metroidvania style 2D action platformer game based on Korean afterlife world view. Explore 8 different area of purgatory by becoming the main character 'Arum'. Solve the mystery of happening on purgatory through fight against the specter and lead fugitive souls to the right path.,,137635,668550
517953,fr,8Doors: Arum's Afterlife Adventure,,"8Doors is a story-driven Metroidvania-style action platformer heavily influenced by Korean folktales. Play as ‘Arum’, a brave girl that has entered the realm of the afterlife in search of her father’s soul and guide her through the '8 Doors of Purgatory' to solve the mysteries that lie deep within.",steam,137635,668550
492070,,Crush Your Enemies,,"Strategy games have become too stuffy, bogged down with diplomacy, endless repositioning, waiting....ugh, so much waiting. Crush Your Enemies is a RTS distilled down to the basics - foul-mouthed barbarians, gratuitous use of ""bollocks,"" and more chest hair than you can handle.",,17027,406850
492070,fr,Crush Your Enemies,,"Retrouvez le plaisir intense des jeux de stratégie en temps réel. Crush Your Enemies renoue avec tout ce qui a pu vous vous donner autant de plaisir : planification, choix d’unités, gestion des ressources, occupation de territoires ennemis, manœuvres tactiques sur le champ de bataille.",steam,17027,406850
15512,,Star Wars: Jedi Knight - Jedi Academy,,"Star Wars: Jedi Knight: Jedi Academy, of the highly acclaimed Jedi Knight series, allows players to take on the role of a new student eager to learn the ways of the Force from Jedi Master Luke Skywalker. Interact with famous Star Wars characters in many classic Star Wars locations as you face the ultimate choice: fight for good and freedom on the light side, or follow the path of power and evil to the dark side.",,153,6020
15512,fr,Star Wars: Jedi Knight - Jedi Academy,,Forge your weapon and follow the path of the Jedi Jedi Knight: Jedi Academy is the latest installment of the highly acclaimed Jedi Knight series. Take on the role of a new student eager to learn the ways of the Force from Jedi Master Luke Skywalker.,steam,153,6020
491491,,Attack on Titan,,"Attack on Titan closely follows the riveting story line of Attack on Titan’s first season and focuses on the exploits of various key characters, putting the player in a position to relive the anime’s most shocking, courageous, and exhilarating moments. It revolves around the story of three young people who survive the destruction of their walled city district by enormous, man-eating Titans and eventually go on to join the Scout Regiment in order to protect humanity from this overpowering foe.",,14879,449800
491491,fr,Attack on Titan,,"Un dessin animé au succès international, &quot;Attack on Titan&quot;, débarque sur Steam® ! Le combat fait rage entre les Titans mangeurs d'hommes et Eren et ses camarades. Vivez l'illusion d'être dans le dessin animé et contrôlez le déroulement de l'histoire. À vous de vivre le scénario du dessin animé...",steam,14879,449800
506098,,Stopots,,"Stopots is a game whose it pick a letter and its has categories and then you need to put words with that letter as a start letter, and it need to be in the category.",,50157,
461221,,Marvel: Contest of Champions,,"Prepare for epic versus-fighting action with your favorite Marvel Super Heroes & Super Villains in the ultimate cosmic showdown! Spider-Man, Iron Man, Wolverine & more await your summons to battle! Assemble a team & begin your quest to become the Ultimate Marvel Champion!",,28107,
5338,,Rayman 3: Hoodlum Havoc,,Hoodlum Havoc is a 3-D platformer from Ubisoft starring limbless hero Rayman. A hilarious story takes a few twists as Rayman sets out to stop the evil black lum Andre and his army of hoodlums.,,1966,
544992838,,Mega Man Battle Network 3 Blue & White,,"Lan and Mega Man are ready to prove they're the strongest in the next tournament! But there seems to be a more sinister plan behind the event... Game content is the same for MEGA MAN BN 3 WHITE and MEGA MAN BN 3 BLUE, but NetNavi chips and other items may differ.",,85282,
1407473558,,IMMORTAL: Gates of Pyre,,,,,
34226,,Rayman Legends,,"The Glade of Dreams is in trouble once again! The nightmares multiplied and spread, creating new monsters even more terrifying than before!",,1968,242550
34226,fr,Rayman Legends,,"Rayman, le héros du jeu de plates-formes le plus acclamé et récompensé en 2011, revient sur PC dans Rayman Legends.Michel Ancel, célèbre créateur de Rayman®, Beyond Good et Evil® et des Lapins Crétins™ apporte encore une fois toute sa créativité au service d’une nouvelle aventure haute en couleur pour son personnage de Rayman.",steam,1968,242550
2098897146,,Metro: Last Light Redux,,"Metro: Last Light Redux is the definitive version of the critically acclaimed ‘Metro: Last Light’, rebuilt in the latest and greatest iteration of the 4A Engine for Next Gen. Newcomers will get the chance to experience one of the finest story-driven shooters of all time; an epic adventure combining gripping survival horror, exploration and tactical combat and stealth. 
 
This definitive version also includes all previously released DLC, adding 10 hours of bonus single-player content to the huge solo campaign. Fans of the original game will notice new features and gameplay improvements, including new melee animations, the ability to check your watch and ammo supplies on the fly, and new full-body player animations. 
 
And those who favoured the more survival-horror oriented gameplay of the cult prequel ‘Metro 2033’ will find a new way to experience the campaign thanks to the introduction of two unique Play Styles – Survival and Spartan. The former transforms Last light from a more action-oriented stealth combat experience to a fraught, slow burn fight for survival. With the legendary Ranger Mode included to offer an extra layer of challenge and immersion, Metro: Last Light Redux offers hours of AAA gameplay for an incredible price. 
 
Game Features 
 
Immerse yourself in the Moscow Metro - witness one of the most atmospheric worlds in gaming brought to life with stunning next-gen visuals at 60FPS Brave the horrors of the Russian apocalypse - equip your gasmask and an arsenal of hand-made weaponry as you face the threat of deadly mutants, human foes, and the terrifying environment itself 
   
Rebuilt and Remastered for next-gen - with all previous DLC content included, new modes and features, and many gameplay improvement, this is the definitive version of the critically acclaimed classic that fans and newcomers alike will enjoy 
   
Two unique Play Styles : ""Spartan"" and ""Survival"" - approach the game as a slow burn Survival Horror, or tackle it with the combat skills of a Spartan Ranger in these two unique modes 
   
The legendary Ranger Mode returns - dare you play the fearsome Ranger Mode? No HUD, UI, deadlier combat and limited resources combine to create the ultimate immersive experience 
  
Based on the internationally bestselling novel series by Dmitry Glukhovsky",,539,287390
2098897146,fr,Metro: Last Light Redux,,"It is the year 2034. Beneath the ruins of post-apocalyptic Moscow, in the tunnels of the Metro, the remnants of mankind are besieged by deadly threats from outside – and within. Mutants stalk the catacombs beneath the desolate surface, and hunt amidst the poisoned skies above.",steam,539,287390
144071,,DreadOut,,"When twilight fades. Where darkness reigns.

DreadOut is a third person supernatural horror game where you play as Linda, a high school student trapped in an old abandoned town. Equipped with her trusty smart-phone, she will battle against terrifying encounters and solve mysterious puzzles which will ultimately determine her fate.
Help her overcome the challenges that will stand before her. Survive the Dread!",,11712,269790
144071,fr,DreadOut,,"DreadOut is a third person supernatural horror game where you play as Linda, a high school student trapped in an old abandoned town. Equipped with her trusty smart-phone, she will battle against terrifying encounters and solve mysterious puzzles which will ultimately determine her fate.",steam,11712,269790
1476615586,,Spirit Swap: Lofi Beats to Match-3 To,,"Spirit Swap: Lofi Beats to Match-3 To is an action-puzzle game set in a lush, narrative-driven world of witchy demons. Cast spells, be queer, & crash the biggest concert of the year!",,145872,
31080,,Bingo,,,,86064,
509235,,Märchen Forest: Mylne and the Forest Gift,,"Freely roam a fully 3D-rendered mystical forest together with Mylne, a young girl employed at a magical apothecary shop!",,99425,842810
509235,fr,Märchen Forest: Mylne and the Forest Gift,,"Freely roam a fully 3D-rendered mystical forest together with Mylne, a young girl employed at a magical apothecary shop!",steam,99425,842810
7523,,Tomb Raider: Anniversary,,"Tomb Raider: Anniversary retraces Lara Croft's original genre-defining adventure — globe-trotting 3rd person action-adventure in pursuit of the legendary Scion artifact. Using an enhanced 'Tomb Raider: Legend' game engine, the graphics, technology and physics bring Lara's adventure and pursuit of a mystical artifact known only as the Scion right up to today's technology standards and offers gamers a completely new gameplay experience. Re-imagined, Anniversary delivers a dynamic fluidly and fast Lara Croft, massive environments of stunning visuals, intense combat and game pacing, and an enhanced and clarified original story.",,912,224960
7523,fr,Tomb Raider: Anniversary,,"L'aventurière Lara Croft a été engagé pour partir à la recherche d'un ancien artefact connu sous le nom de Scion. Grâce à son style acrobatique, elle court, saute, nage et escalade tout au long de son parcours vers la connaissance des origines et des pouvoirs de cet artefact - laissant seulement des tombes vides et des douilles de...",steam,912,224960
493421,,Silence,,"Silence also known as Silence: The Whispered World 2 is a sequel to The Whispered World, a popular adventure game developed by Daedalic Entertainment. The game is based on the classic point & click mechanics enriched with a number of innovative features.",,115840,
461066,,Absolute Drift,,"In Absolute Drift, you will master the art of drifting. Practice your skills in Free-Roam and compete in drift events such as Driftkhana and Mountain Drifting.",,11587,320140
461066,fr,Absolute Drift,,Absolute Drift est un jeu de course pour devenir un maître dans l'art du drift.,steam,11587,320140
497461,,Echo Arena,,"The multiplayer mode for Lone Echo that got out of control and became a standalone game. 
 
""In Echo Arena—the fast-paced competitive multiplayer mode for Lone Echo—you’ll join a team of up to four other players and face off against the competition in a 0-g clash of robotic glory as you glide, boost, and punch your way to scoring goals in a breathtaking virtual arena. 
 
As a team sport, Echo Arena rewards players that work well together; with the incredible social expression offered by the Oculus Touch platform, you’ll be able signal for a pass with a shout and a wave just as you naturally would, while throwing and catching the disc becomes a valuable skill to master. 
 
Even better though, Echo Arena is also full-contact sport: make a fist and use a swift punch to an opponent’s head to stun them, or grab onto another player’s back and catch a ride down-field. And of course, after you score a goal you can flaunt it with your own victory dance.""",,37091,
1949521322,,From Darkness,,"From the darkness of the forest, bandits and looters will aim to destroy your way of life and demolish your livelihood. With the help of vagabonds and villagers, build a thriving town, raise an army and defend your home. Each night brings with it more enemies, so be sure to keep up.",,113319,918550
1949521322,fr,From Darkness,,"From the darkness of the forest, bandits and looters will aim to destroy your way of life and demolish your livelihood. With the help of vagabonds and villagers, build a thriving town, raise an army and defend your home. Each night brings with it more enemies, so be sure to keep up.",steam,113319,918550
25122,,Just Dance,,"Dance to the rhythm of your favorite beat with Just Dance, a music & rhythm video game that allows you to dance the night away with your friends and family without ever leaving the house. With simple pick-up and play controls, anyone can join the party.",,2704,
13961,,Resident Evil Outbreak File #2,,"Resident Evil Outbreak File #2 is an online game for the PlayStation 2 which was first released in September 2004 in Japan. It is a sequel and expansion on Resident Evil Outbreak, which was originally envisioned as a much larger game before being cut into multiple releases, containing levels which failed to be completed in time for the original game's release. 
 
The same eight characters from the first title return with similar abilities, and the game takes place once again in a zombie-run Raccoon City. The new game has several new scenarios and boasts new gameplay developments for the Resident Evil series. Loading times have been reduced and while the previous Outbreak was on-line enabled in the US, this game is the first on-line Resident Evil game in Europe.  
  
The locals featured in this game include both the familiar (The Raccoon Police Department) and the exotic (A mutated jungle at mid-day) ones. The game boasts a hefty amount of unlockable material such as artworks, notes, trivia, and character costumes. The game is backwards compatible with your save file from Resident Evil: Outbreak, meaning that you can take your unlocked content to this new setting.",,972,
