TwitchCategoryId,Language,Name,Synopsis,Summary,Source,IGDBId
505371,,Marvel's Spider-Man,,"Starring the world’s most iconic Super Hero, Spider-Man features the acrobatic abilities, improvisation and web-slinging that the wall-crawler is famous for, while also introducing elements never-before-seen in a Spider-Man game. From traversing with parkour and utilizing the environment, to new combat and blockbuster set pieces, it’s Spider-Man unlike any you’ve played before.",,19565
500633,,World War Z,,"Humanity is on the brink of extinction. From New York to Moscow and Jerusalem, the undead apocalypse continues to spread. As the end looms, a hardened few bands together to defeat the horde and outlive the dead. 
 
World War Z is a heart-pounding co-op third-person shooter for up to 4 players featuring swarms of hundreds of zombies. Based on the Paramount Pictures film, World War Z focuses on fast-paced gameplay while exploring new storylines from around the world.",,20910
21101,fr,Batman: Arkham Asylum,,Soyez Batman et affrontez les super-vilains de Gotham City. Parcourez l'asile d'Arkham et son île terrifiante.,steam,500
27761,fr,The Bureau: XCOM Declassified,,"1962. La guerre froide terrifie le pays. Un organisme officiel top secret, le Bureau, enquête sur des attaques émanant d'un ennemi plus puissant que le bloc communiste. Vous, l'agent Carter, mènerez l'enquête, appuierez sur la détente et dirigerez votre groupe dans ce shooter tactique en vue extérieure sur fond de guerre clandestine...",steam,244
1065831164,,Devil inside,,,,46940
18888,,Warhammer Online: Age of Reckoning,,"An MMORPG based on the Games Workshop franchise developed by Mythic Entertainment and produced by Electronic Arts. Some of the features were brutal RvR battles (Realm vs Realm) and siege warfare. Warhammer Online was shut down December 18th, 2013.",,215
18808,fr,Resident Evil 5,,"Ce jeu est une adaptation de la version Games for Windows - Live, sortie en 2009. Acheter le pack &quot;Untold Stories Bundle&quot; sur Steam correspondra a mettre à jour vers &quot;Resident Evil 5 Gold Edition&quot;.",steam,847
498510,,Yakuza Kiwami 2,,"Yakuza Kiwami 2 is a remake of Yakuza 2, and is an action-adventure game set in an open world environment and played from a third-person perspective. Combat is based on that previously seen in Yakuza 6. A new ""Majima Saga"" story scenario features recurring series anti-hero Goro Majima as a playable character.",,2060
500627,fr,GTFO,,"GTFO is a hardcore 4 player cooperative first-person shooter, with a focus on team play and atmosphere. It features edge-of-your-seat suspense, team-based puzzle-solving and high-intensity combat.",steam,36646
14805,,Metal Gear Solid,,"A third-person story-heavy stealth action title which follows Solid Snake, a special operations soldier, who infiltrates a nuclear weapons facility by the name of Shadow Moses Island to neutralize a renegade special forces unit named FOXHOUND. Throughout his journey, he uncovers various lies and military conspiracies, and his ideas of trust, violence and control are challenged.",,375
509974,,Ragnarok M: Eternal Love,,"Ragnarok M: Eternal Love is a free-to-play fantasy RPG based off the original Ragnarok Online franchise, developed by XD Global and licensed by Gravity Interactive.",,111880
460639,fr,The Talos Principle,,"Le Principe de Talos est un jeu d'énigme philosophique à la première personne de Croteam (Serious Sam), écrit par Tom Jubert (FTL, Le Swapper) et Jonas Kyratzes (Infinite Ocean). Résolvez des énigmes complexes tissées dans une parabole métaphysique sur l'intelligence et le sens dans un monde condamné.",steam,7386
505786,fr,OMORI,,"Explore a strange world full of colorful friends and foes. When the time comes, the path you’ve chosen will determine your fate... and perhaps the fate of others as well.",steam,26673
512890,,Narita Boy,,"The retro-futuristic pixel game 
 
Explore and fight in a retro-futuristic world. Swim deep into a oneiric, poetic and unique experience across dimensional planes. 
 
The aesthetic of the game was inspired by retro pixel adventures (Castlevania, Another World, Double Dragon) with a modern touch (Superbrothers, Sword and Sorcery) and an 80s plot homage (Ready Player One, He-Man, The Last Starfighter), accompanied by the retro synth touch of the old glory days.",,27409
493887283,,Casino,,"Casino is a collection of three card games: Blackjack, Five-card stud poker, Poker Solitaire.",,54797
24239,,Super Mario Galaxy 2,,"Super Mario Galaxy 2 is the sequel to Super Mario Galaxy and the fourth 3D platformer entry in the Mario franchise. The sequel retains many elements from its predecessor, such as the adventure being in outer space, the element of gravity, and recurring objects such as Launch Stars and Sling Stars. Returning items include the Bee Mushroom and the Fire Flower. However, the game introduces new elements as well, such as the utilization of Yoshi, new power-ups like the Cloud Flower, and the use of a guide within the game for beginner players.",,1078
506489,,Vigor,,"Norway, 1991. 
 
Civilization lies in ruin. Will you rise from the debris? 
 
Scandinavia, mostly untouched by the fallout of the war, remains the last safe zone in a post-apocalyptic Europe. 
 
Norway, once a haven, has transformed into a cut-throat land of survival where only the ruthless – or cunning – make it out alive.",,103328
1900396348,,POPULATION: ONE,,"Fly anywhere, climb anything, build defenses... All in a VR Battle Royale.",,139377
496661,,Gartic,,"Gartic is a brazillian game, whose someone need to draw and the others players need to guess it.",,50158
495061,,Xenoblade Chronicles 2,,"As the giant beasts march toward death, the last hope is a scavenger named Rex—and Pyra, a living weapon known as a Blade. Can you find the fabled paradise she calls home? Command a group of Blades and lead them to countless strategic victories before the world ends. 
 
Each Titan hosts its own distinct cultures, wildlife, and diverse regions to explore. Search the vast open areas and labyrinthine corridors for treasure, secret paths, and creatures to battle and index. 
 
During these escapades you'll get to know a large cast of eclectic characters, including the weaponized life forms known as Blades. Gather these allies, bond with them to increase their power, and utilize their special ARTS to devastate enemies. But to save the world of Alrest, you must first demystify its cloudy past. 
 
A new story in the Xenoblade Chronicles series 
 
The next adventure is on the Nintendo Switch console—set on the backs of colossal, living Titans. 
 
Discover each Titan’s diverse regions, culture, wildlife, equipment, and hidden secrets. 
 
Find, bond with, and command weaponized life forms known as Blades to earn abilities and enhance them. 
 
Uncover the history of Alrest and the mystery of its endless ocean of clouds.",,26766
488518,fr,Friday the 13th: The Game,,Jason is back! Jason Voorhees is unleashed and stalking the grounds of Camp Crystal Lake! Friday the 13th: The Game is one of the most highly-anticipated horror titles of all time. You will finally be able to take on the role as Jason Voorhees and Camp Crystal Lake counselors.,steam,14389
13420,,Jak and Daxter: The Precursor Legacy,,"From the creator and developer of the acclaimed, top-selling Crash Bandicoot series comes the next generation in interactive entertainment. 
 
Expect the unexpected! Enter a new world of magic, adventure, exploration, and discovery where enormous vistas and exotic characters lead you to places beyond your imagination. Test your wits and your skills as you embark on a journey to reverse your best friend's transformation into a furry Ottsel, even as he entangles you in his amusing antics. Discover twisted corruption and battle the sinister minds behind this chilling plot. Light Eco. Precursor Technology. Power Cells. Dark Eco. What does it all mean? 
 
Only one person holds the secret behind the power of the mysterious Eco. Together you must now take on these endeavors. 
 
 
 
Unleash the hero within. A new legacy is born!",,1528
20063,,Silkroad Online,,Silkroad Online is a free MMORPG made by Joymax that is based on the silkroad trading routes in ancient China.,,72944
10033,,Banjo-Kazooie,,"In this 3D platformer, the heroic but naive bear Banjo enlists his cowardly bird buddy Kazooie to help rescue his younger sister from a vain, beauty-stealing witch. The player is tasked with exploring the witch's lair and the nine large, open levels within it, looking for tasks and challenges to complete. Along the way they meet a variety of characters who teach them new moves and transform them into different animals. Modeled after Super Mario 64, Banjo-Kazooie is distinguished by its cheeky and sarcastic sense of humor and by a large, varied, and novel moveset.",,2148
4187,,Trash,,"Trash is a real-time strategy computer game developed by Inhuman Games for the Microsoft Windows operating systems. It was released on September 20, 2005.",,94319
509506,,Shell Shockers,,,,111890
512708,,Mahjong Soul,,"Mahjong Soul lets you experience exciting Mahjong matches versus players from around the world. 
Mahjong Soul gives you the chance to be accompanied by cute anime girls of your dreams. 
 
Looking for a relaxing yet competitive game? Join us on Mahjong Soul!",,117263
3951,,RF Online,,RF Online is a Korean 3D MMORPG,,22579
491381,fr,Golf With Your Friends,,"À quoi servent les amis, sinon à jouer au golf... entre amis ? Tous les coups sont permis sur ces parcours de minigolf endiablés et stimulants, jouables jusqu'à 12 joueurs en simultané !",steam,24985
349971132,,Pokémon Planet,,Pokemon Planet MMO from pokemon-planet.com,,143403
19622,,Dead Island,,"Dead Island is a action role-playing survival horror video game developed by Polish developer Techland and it is centered on the challenge of surviving a zombie-infested open world island with a major emphasis on melee combat, and the making of weapons and weapon mods. You gain XP and level up, gaining skill points. 
 
Dead Island takes place on the fictional (based off a true island near Papua New Guinea) island of Banoi. You play as one of four different characters with different skills and skill trees, and different intro videos. The worlds is half open, you can roam the world as you wish but you will have to go through the main story to progress to the next large open area 
 
The combat is largely melee focused, but you also have firearms and throwing weapons, bullets and guns are scares in the start of the game, but towards the end of the game they are much easier to find. The zombies are mostly slow, but there is a wide range of different zombies throughout the game. 
 
Dead Island: Riptide, was released in 2013. A spin-off, Escape Dead Island, 
Dead Island 2, is set to be released in 2016.",,536
512693,fr,Dota Underlords,,Recrutez votre équipe et anéantissez vos rivaux dans ce nouveau jeu de combats et de stratégie issu de l'univers de Dota. La saison 1 est maintenant disponible : explorez Flèche blanche et gagnez des récompenses du passe de bataille.,steam,119416
516096,fr,Monster Train,,"Monster Train est un jeu stratégique de construction de deck original roguelike. À bord d'un train pour l'enfer, vous devrez prendre les bonnes décisions pour défendre de multiples champs de bataille verticaux. Monster Train arrive toujours à l'heure.",steam,129483
490644,fr,Divinity: Original Sin II,,"Le célèbre RPG auquel tous les autres sont comparés, par les créateurs de Baldur's Gate 3. Constituez votre groupe. Apprenez à maîtriser des phases de combat tactiques. Formez un groupe de 4 aventuriers avec d'autres joueurs, mais sachez qu'un seul d'entre vous aura la possibilité de devenir un...",steam,11800
514152,fr,Fault,,"At the intersection of colliding universes, you bring your Hero to fight for the survival of your world. Become imbued with power from your Aspects and equip yourself with your Factions' legendary gear in this next-gen, action-packed, third-person MOBA. Prepare yourself for battle at the FAULT.",steam,77277
512821,,Words On Stream,,,,137688
508509,,Codenames,,"The two rival spymasters know the secret identities of 25 agents. Their teammates know the agents only by their CODENAMES. 
 
The teams compete to see who can make contact with all of their agents first. Spymasters give one-word clues that can point to multiple words on the board. Their teammates try to guess words of the right color while avoiding those that belong to the opposing team. And everyone wants to avoid the assassin. 
 
Codenames: win or lose, it’s fun to figure out the clues.",,105254
29918,fr,Warface,,"Mélange explosif de MMO et de FPS à l'action explosive, Warface compte des millions de fans dans le monde entier ! Cet ovni vidéoludique propose des modes JcJ intenses, des missions JcE captivantes et des raids haletants !",steam,1912
512782,,Need for Speed: Heat,,"Hustle by day and risk it all at night in Need for Speed Heat, a white-knuckle street racer, where the lines of the law fade as the sun starts to set. By day, Palm City hosts the Speedhunter Showdown, a sanctioned competition where you earn Bank to customize and upgrade your high-performance cars. At night, ramp up the intensity in illicit street races that build your reputation, getting you access to bigger races and better parts. But stay ready – cops are waiting and not all of them play fair",,119161
511195,fr,DRAGON BALL Z: KAKAROT,,"Revivez l'histoire de Son Goku et des Guerriers Z dans DRAGON BALL Z: KAKAROT ! Au-delà des affrontements épiques, vivez le monde de DRAGON BALL Z, combattez, mangez, pêchez et entraînez-vous avec Son Goku, Son Gohan, Vegeta et les autres.",steam,114009
590233873,,Dragon Quest VIII: Journey of the Cursed King,,"This is a portable version of the classic RPG, with added content and other 3DS enhancements.",,1819
12482,,The Legend of Zelda: Majora's Mask,,"After the events of The Legend of Zelda: Ocarina of Time (1998), Link is assaulted by an imp named Skull Kid under the control of the evil Majora's Mask and gets stuck in a troubled land called Termina. Link must repeat the same 3 days, take on the identities of deceased people from other races, collect numerous masks and rid the land of evil to stop Majora from destroying the world in this third-person action/adventure game.",,1030
23453,fr,Fallout: New Vegas,,Welcome to Vegas. New Vegas. Enjoy your stay!,steam,16
496697,fr,Code Vein,,Unis face à une mort certaine. Aventurez-vous aux confins de l'enfer pour retrouver votre passé et échapper à ce cauchemar éveillé dans CODE VEIN.,steam,28168
19660,fr,Dwarf Fortress,,"The deepest, most intricate simulation of a world that's ever been created. The legendary Dwarf Fortress is now on Steam. Build a fortress and try to help your dwarves survive, OR adventure as a single hero against a deeply generated world.",steam,6341
502914,fr,Blasphemous,,"Blasphemous est un jeu de plateforme-action punitif, avec des combats en hack’n slash impitoyables, au cœur du monde cauchemardesque de Cvstodia. Explorez, améliorez vos capacités et utilisez des exécutions barbares contre des hordes d'ennemis pour réussir à échapper à la damnation éternelle.",steam,26820
512969,fr,Last Oasis,,"Continuez d'avancer, le monde se meurt ! Dans ce MMO de survie nomade, vous pouvez construire des bases mobiles pour voyager. Rejoignez un clan et battez-vous pour un territoire. Armez-vous et chassez, volez et commercez pour rester en vie.",steam,114422
207,,Yu-Gi-Oh! Forbidden Memories,,"Yu-Gi-Oh Forbidden Memories, known in Japan as Yu-Gi-Oh! Shin Duel Monsters (遊戯王真デュエルモンスターズ封印されし記憶), was developed by Konami Computer Entertainment Japan and published by Konami for the PlayStation. It was released in Japan on December 9, 1999, in North America on March 20, 2002, and in Europe on November 22, 2002. The players play the Yu-Gi-Oh! Trading Card Game alongside characters that appear in the series.",,4108
1041038203,,GangV | Battle Royale,,"GangV is an online Battle Royale game in a living environnement with policemen and civilians.  
It is possible to steal cars, mug people in the street and fight with the police during a Battle Royale and in the Open World mode. 
Players can control territory to earn money and the help of gangsters.  
It can be played both in Virtual Reality and in non-VR.",,144201
1654,,Gothic II,,"Gothic II is a role-playing video game and the sequel to Gothic, by the German developer Piranha Bytes. It was first released on November 29, 2002 in Germany, with North America following almost one year later on October 28, 2003. The game was published by JoWooD Entertainment and Atari.",,2262
10209,fr,LEGO Star Wars: The Complete Saga,,"Ramassez des briques du I au VI! Jouez aux 6 films Star Wars en un seul jeu vidéo! Ajout de nouveaux personnages, de nouveaux niveaux, de nouvelles fonctionnalités et pour la première fois, la chance de construire votre chemin et combattre à travers un univers Star Wars amusant sur votre PC!",steam,2682
458224,fr,SOMA,,"Imaginé par les créateurs d’Amnesia: The Dark Descent, SOMA, mêle science-fiction et horreur sous les vagues de l’océan Atlantique. Lutter pour assurer votre survie dans un monde hostile vous conduira à vous interroger sur votre propre existence.",steam,9727
1260,,Age of Mythology,,"This single player scenario features Reginlief, the Valkyrie hero from the main campaign. She must lead her village to find and destroy all the passages from the underworld. This scenario will not be available in the shipped version of the game. 

Your Civilization has survived through the Ages of Empires and Kings. Now with Age of Mythology you'll engage your Human Civilization in the ultimate challenge against the gods, Mythological Creatures and Heroes of Ancient Mythology.",,324
494364,,Death Stranding,,"Action & exploration third person game set in a post-apocalyptic open world. 
 
Developed by Kojima Productions and published first on PS4 by Sony Interactive and later on PC by 505 Games.",,19564
513914,fr,Chicken Police,,"Une folle histoire d'amour, de mort, de poulets et de rédemption ! Chicken Police est un jeu policier d'aventure qui se déroule dans un monde soigneusement élaboré. L'histoire est crue, mais ne manque pas d'une bonne dose d'humour absurde.",steam,119323
512371,,Madden NFL 20,,"Feel like an NFL Superstar in Madden NFL 20. Be the Face of an NFL franchise where the decisions you make matter in your journey to become an NFL Superstar in ‘FACE OF THE FRANCHISE: QB1’. Feel the emotion, personality, and power of NFL Superstars with ‘SUPERSTAR X-FACTOR’, an all-new abilities progression system that reveals special abilities for today’s most exciting NFL Superstars heightening the level strategy and excitement in every game.",,114286
369575,,Rocksmith 2014,,"Plug any electric guitar or bass into your PC, Mac, Xbox 360, or PlayStation 3, Playstation 4 or Xbox One and join over 1.5 million people who have learned to play guitar with award-winning Rocksmith method. Learn to play guitar in 60 days. Get started, now!",,3088
488632,fr,Enter the Gungeon,,"Enter the Gungeon est un jeu d'exploration d'un donjon où une horde d'aventuriers tiraille à tout va, pille, manie la roulade d'esquive et renverse les tables dans l'espoir de trouver la rédemption.",steam,11182
33437,fr,Resident Evil 6,,"Mêlant action et survival horror, Resident Evil 6 s'annonce comme l'expérience horrifique de 2013.",steam,1082
488635,fr,Naruto Shippuden: Ultimate Ninja Storm 4,,Le tout nouvel épisode de la célèbre série STORM vous plonge dans une aventure colorée et époustouflante. Profitez du système de combat entièrement revu et participez aux combats les plus épiques que vous ayez jamais vus !,steam,11059
9522,,Silent Hill 3,,"Silent Hill 3 is the third installment in the Silent Hill survival horror series and a direct sequel to the first game, although this is kept secret from the player for plot twist purposes. Like the previous entries, Silent Hill 3 is a survival horror combining action-based combat and puzzle-solving, but is somewhat more combat-oriented than the preceding installments. The main character is able to side-step and block some attacks, but in general shares with the other protagonists of the series their relative ineptitude in combat.",,482
20050,,Perfect World,,"Discover your place in the struggle for power amidst a realm of stunningly beautiful, fantastical environments. Fly freely to access new heights, set out on new adventures, and obtain more power to spread your name throughout the land.

Take to the skies now and discover the secrets of Perfect World!",,8747
517447,,TETR.IO,,"TETR.IO is a modern yet familiar online stacker. Play against friends and foes all over the world, or claim a spot on the leaderboards - the stacker future is yours! 
 
Programmed, developed and designed by osk.",,135596
18181,,Final Fantasy Tactics,,Lead epic battles in a new Final Fantasy world. Betrayal and darker dealings await in Square Soft's game of war. Fight hundreds of battles across dangerous 3D terrain as an ancient blood feud awakens a deadlier foe.,,428
491437,fr,Call of Duty: Infinite Warfare,,"Infinite Warfare vous propose 3 modes de jeu : Campagne, Multijoueur et Zombies.",steam,18968
490378,fr,South Park: The Fractured But Whole,,"From the creators of South Park, Trey Parker and Matt Stone, comes South Park: The Fractured But Whole, a sequel to 2014's award-winning South Park: The Stick of Truth.",steam,11161
18889,fr,Final Fantasy XIII,,"Final Fantasy XIII est un RPG dans lequel un groupe d'humains affronte le destin, dans la cité suspendue de Cocoon et le monde primitif de Pulse. Suivez Lightning à travers des combats intenses. L'aventure vous attend dans ce monde mystérieux...",steam,389
391475,fr,Space Engineers,,Space Engineers est un jeu de sandbox à monde ouvert caractérisé par la créativité et l'exploration.,steam,3239
509529,fr,Super Animal Royale,,"Une lutte pour la survie ! Super Animal Royale est un jeu de bataille royale en 2D frénétique à 64 joueurs où des animaux meurtriers s'affrontent dans un parc safari abandonné à coups de dents, de griffes et de mitrailleuses.",steam,109826
493388,fr,Foxhole,,Foxhole est un jeu massivement multijoueur où vous coopérez avec des centaines de joueurs pour façonner le résultat d'une guerre en ligne persistante. C'est le jeu de stratégie et de tactiques collaboratives ultime. Chaque action que vous entreprenez peut avoir un effet puissant à travers un monde en état de guerre.,steam,27091
19180,,Final Fantasy XV,,"Take the journey, now in ultimate quality. Boasting a wealth of bonus content and supporting ultra high-resolution graphical options and HDR 10, you can now enjoy the beautiful and carefully-crafted experience of FINAL FANTASY XV like never before.",,359
518618,,Scrutinized,,"Work to expose the numerous criminal degenerates that plague your quiet town. Use citizen-issued reports, police records, social media accounts, text conversations, and more to determine who’s an actual threat and who’s harmless, all while avoiding the killers trying to infiltrate your home.",,136668
488820,fr,Stranded Deep,,Take the role of a plane crash survivor stranded somewhere in the Pacific Ocean. Come face to face with some of the most life threatening scenarios that will result in a different experience each time you play. Scavenge. Discover. Survive.,steam,8751
490948,fr,The Isle,,Experience fierce open world survival gameplay as you attempt to stay alive on an unforgiving island inhabited by dinosaurs! Hunt. Grow. Survive.,steam,25838
515066,,SnowRunner,,"SnowRunner puts you in the driver’s seat of powerful vehicles as you conquer extreme open environments with the most advanced terrain simulation ever. Drive 40 vehicles from brands such as Ford, Chevrolet, and Freightliner as you leave your mark on an untamed open world. 
 
Overcome mud, torrential waters, snow, and frozen lakes while taking on perilous contracts and missions. Expand and customize your fleet with many upgrades and accessories including an exhaust snorkel for heavy waters or chain tires to battle the snow.",,107215
509698,fr,DiRT Rally 2.0,,"DiRT Rally 2.0 vous invite à arpenter les circuits de rallye les plus emblématiques du globe, dans les véhicules tout-terrain les plus puissants jamais conçus. Mais n'oubliez pas que la moindre erreur peut mettre fin à votre étape.",steam,110411
505939,,ZombsRoyale.io,,"Dive into the #1 2D battle royale game in the world - now on Discord. 100 player, real-time multiplayer action with vibrant graphics and dynamic gameplay all packed in 5 minute matches. How many victories can you get while decking yourself out in the fresh cosmetics?",,101161
32345,fr,Borderlands 2,,The Ultimate Vault Hunter’s Upgrade lets you get the most out of the Borderlands 2 experience.,steam,1011
512895,,Watch Dogs: Legion,,"In Watch Dogs: Legion, near future London is facing its downfall...unless you do something about it. Build a resistance, fight back, and give the city back to the people. It’s time to rise up.",,100413
18707,fr,Grand Theft Auto IV,,"Niko Bellic, Johnny Klebitz et Luis Lopez ont une chose en commun : ils vivent dans la ville la plus terrible d'Amérique. Liberty City est une ville où l'argent et le statut social règnent en maîtres. Un paradis pour ceux qui ont tout, un enfer pour les autres.",steam,731
418063,fr,Five Nights at Freddy's,,"Welcome to your new summer job at Freddy Fazbear's Pizza, where kids and parents alike come for entertainment and food! The main attraction is Freddy Fazbear, of course; and his two friends. They are animatronic robots, programmed to please the crowds!",steam,8499
